Authors,Author full names,Author(s) ID,Title,Year,Source title,Volume,Issue,Art. No.,Page start,Page end,Page count,Cited by,DOI,Link,Abstract,Author Keywords,Index Keywords,Document Type,Publication Stage,Open Access,Source,EID
Vonkova H.; Zamarro G.; Hitt C.,"Vonkova, Hana (42262790700); Zamarro, Gema (6505942728); Hitt, Collin (56436461700)",42262790700; 6505942728; 56436461700,Cross-Country Heterogeneity in Students’ Reporting Behavior: The Use of the Anchoring Vignette Method,2018,Journal of Educational Measurement,55,1,,3,31,28,13,10.1111/jedm.12161,https://www.scopus.com/inward/record.uri?eid=2-s2.0-85042724700&doi=10.1111%2fjedm.12161&partnerID=40&md5=de93b0e88826b1d5399f42800bfc9851,Self-reports are an indispensable source of information in education research but they are often affected by heterogeneity in reporting behavior. Failing to correct for this heterogeneity can lead to invalid comparisons across groups. The researchers use the parametric anchoring vignette method to correct for cross-country incomparability of students’ reports on teacher's classroom management. Their analysis is based on the data from the Programme for International Student Assessment 2012. The results show significant variation in implicit standards across countries. Correlations between countries’ average teacher classroom management levels and external variables like students test scores and public expenditure per pupil change substantially after vignette adjustment. The researchers conclude that the anchoring vignettes method shows potential to enhance the comparability of self-reported measures in education. Copyright © 2018 by the National Council on Measurement in Education,,,Article,Final,,Scopus,2-s2.0-85042724700
Kim K.Y.; Lee W.-C.,"Kim, Kyung Yong (57205130600); Lee, Won-Chan (57203094500)",57205130600; 57203094500,Confidence Intervals for Weighted Composite Scores Under the Compound Binomial Error Model,2018,Journal of Educational Measurement,55,1,,152,172,20,1,10.1111/jedm.12168,https://www.scopus.com/inward/record.uri?eid=2-s2.0-85042684022&doi=10.1111%2fjedm.12168&partnerID=40&md5=e76f8cad7c9c299ffac999edf5d035a7,"Reporting confidence intervals with test scores helps test users make important decisions about examinees by providing information about the precision of test scores. Although a variety of estimation procedures based on the binomial error model are available for computing intervals for test scores, these procedures assume that items are randomly drawn from a undifferentiated universe of items, and therefore might not be suitable for tests developed according to a table of specifications. To address this issue, four interval estimation procedures that use category subscores for the computation of confidence intervals are presented in this article. All four estimation procedures assume that subscores instead of test scores follow a binomial distribution (i.e., compound binomial error model). The relative performance of the four compound binomial–based interval estimation procedures is compared to each other and to the better known normal approximation and Wilson score procedures based on the binomial error model. Copyright © 2018 by the National Council on Measurement in Education",,,Article,Final,,Scopus,2-s2.0-85042684022
Ames A.; Smith E.,"Ames, Allison (55438123900); Smith, Elizabeth (57203657003)",55438123900; 57203657003,Subjective Priors for Item Response Models: Application of Elicitation by Design,2018,Journal of Educational Measurement,55,3,,373,402,29,3,10.1111/jedm.12184,https://www.scopus.com/inward/record.uri?eid=2-s2.0-85052605958&doi=10.1111%2fjedm.12184&partnerID=40&md5=792399a24789947429d8ab2e7a6e743f,"Bayesian methods incorporate model parameter information prior to data collection. Eliciting information from content experts is an option, but has seen little implementation in Bayesian item response theory (IRT) modeling. This study aims to use ethical reasoning content experts to elicit prior information and incorporate this information into Markov Chain Monte Carlo (MCMC) estimation. A six-step elicitation approach is followed, with relevant details at each stage for two IRT items parameters: difficulty and guessing. Results indicate that using content experts is the preferred approach, rather than noninformative priors, for both parameter types. The use of a noninformative prior for small samples provided dramatically different results when compared to results from content expert–elicited priors. The WAMBS (When to worry and how to Avoid the Misuse of Bayesian Statistics) checklist is used to aid in comparisons. © 2018 by the National Council on Measurement in Education",,,Article,Final,,Scopus,2-s2.0-85052605958
Man K.; Harring J.R.; Sinharay S.,"Man, Kaiwen (57201031909); Harring, Jeffrey R. (15845554600); Sinharay, Sandip (6602980064)",57201031909; 15845554600; 6602980064,Use of Data Mining Methods to Detect Test Fraud,2019,Journal of Educational Measurement,56,2,,251,279,28,22,10.1111/jedm.12208,https://www.scopus.com/inward/record.uri?eid=2-s2.0-85066786433&doi=10.1111%2fjedm.12208&partnerID=40&md5=5cfe6d291b2244315e524e945e83cd05,"Data mining methods have drawn considerable attention across diverse scientific fields. However, few applications could be found in the areas of psychological and educational measurement, and particularly pertinent to this article, in test security research. In this study, various data mining methods for detecting cheating behaviors on large-scale assessments are explored as an alternative to the traditional methods including person-fit statistics and similarity analysis. A common data set from the Handbook of Quantitative Methods for Detecting Cheating on Tests (Cizek & Wollack) was used for comparing the performance of the different methods. The results indicated that the use of data mining methods may combine multiple sources of information about test takers' performance, which may lead to higher detection rate over traditional item response and response time methods. Several recommendations, all based on our findings, are provided to practitioners. © 2019 by the National Council on Measurement in Education",,,Article,Final,,Scopus,2-s2.0-85066786433
Skaggs G.; Hein S.F.; Wilkins J.L.M.,"Skaggs, Gary (20436934200); Hein, Serge F. (23989287600); Wilkins, Jesse L. M. (7201997260)",20436934200; 23989287600; 7201997260,Diagnostic Profiles: A Standard Setting Method for Use With a Cognitive Diagnostic Model,2016,Journal of Educational Measurement,53,4,,448,458,10,5,10.1111/jedm.12125,https://www.scopus.com/inward/record.uri?eid=2-s2.0-84999672253&doi=10.1111%2fjedm.12125&partnerID=40&md5=d7a7543c1e5423b1b108edd82df2f76f,"This article introduces the Diagnostic Profiles (DP) standard setting method for setting a performance standard on a test developed from a cognitive diagnostic model (CDM), the outcome of which is a profile of mastered and not-mastered skills or attributes rather than a single test score. In the DP method, the key judgment task for panelists is a decision on whether or not individual cognitive skill profiles meet the performance standard. A randomized experiment was carried out in which secondary mathematics teachers were randomly assigned to either the DP method or the modified Angoff method. The standard setting methods were applied to a test of student readiness to enter high school algebra (Algebra I). While the DP profile judgments were perceived to be more difficult than the Angoff item judgments, there was a high degree of agreement among the panelists for most of the profiles. In order to compare the methods, cut scores were generated from the DP method. The results of the DP group were comparable to the Angoff group, with less cut score variability in the DP group. The DP method shows promise for testing situations in which diagnostic information is needed about examinees and where that information needs to be linked to a performance standard. Copyright © 2016 by the National Council on Measurement in Education",,,Article,Final,All Open Access; Bronze Open Access,Scopus,2-s2.0-84999672253
Feuerstahler L.; Wilson M.,"Feuerstahler, Leah (55998816100); Wilson, Mark (55547134983)",55998816100; 55547134983,Scale Alignment in Between-Item Multidimensional Rasch Models,2019,Journal of Educational Measurement,56,2,,280,301,21,7,10.1111/jedm.12209,https://www.scopus.com/inward/record.uri?eid=2-s2.0-85066809925&doi=10.1111%2fjedm.12209&partnerID=40&md5=8ed824dfb160703c4f3f7be67244bbbb,"Scores estimated from multidimensional item response theory (IRT) models are not necessarily comparable across dimensions. In this article, the concept of aligned dimensions is formalized in the context of Rasch models, and two methods are described—delta dimensional alignment (DDA) and logistic regression alignment (LRA)—to transform estimated item parameters so that dimensions are aligned. Both the DDA and LRA methods are applied to real and simulated data, and it is demonstrated that both methods are broadly effective for achieving aligned scales. The routine use of scale alignment methods is recommended prior to comparing scores across dimensions. © 2019 by the National Council on Measurement in Education",,,Article,Final,All Open Access; Green Open Access,Scopus,2-s2.0-85066809925
Leighton J.P.,"Leighton, Jacqueline P. (7101772605)",7101772605,Students’ Interpretation of Formative Assessment Feedback: Three Claims for Why We Know So Little About Something So Important,2019,Journal of Educational Measurement,56,4,,793,814,21,31,10.1111/jedm.12237,https://www.scopus.com/inward/record.uri?eid=2-s2.0-85071013226&doi=10.1111%2fjedm.12237&partnerID=40&md5=fdd952a0fb831933005145a5c60507ad,"If K-12 students are to be fully integrated as active participants in their own learning, understanding how they interpret formative assessment feedback is needed. The objective of this article is to advance three claims about why teachers and assessment scholars/specialists may have little understanding of students’ interpretation of formative assessment feedback. The three claims are as follows. First, there is little systematic research of K-12 students’ interpretations of feedback. Systematic research requires gathering substantive evidence of students’ cognitive and emotional processes using psychological methods and tools. Second, there is an overemphasis on the external assessment process at the expense of uncovering learners’ internal reasoning and emotional processes. This overemphasis may be due to vestiges of behavioral approaches and lack of training in social cognitive methods. Third, there are psychological tools such as the clinical interview, pioneered by Piaget and used by psychologists to “enter the child's mind,” which may be helpful in uncovering students’ interpretation of feedback and associated behavioral responses. If the purpose of formative assessment is to change student learning, and feedback is delivered as a conduit to help with this long-term change, understanding students’ interpretation of feedback plays a central role in the validity of the process. © 2019 by the National Council on Measurement in Education",,,Article,Final,,Scopus,2-s2.0-85071013226
Li J.; van der Linden W.J.,"Li, Jie (57191227791); van der Linden, Wim J. (55409657500)",57191227791; 55409657500,A Comparison of Constraint Programming and Mixed-Integer Programming for Automated Test-Form Generation,2018,Journal of Educational Measurement,55,4,,435,456,21,2,10.1111/jedm.12187,https://www.scopus.com/inward/record.uri?eid=2-s2.0-85057533933&doi=10.1111%2fjedm.12187&partnerID=40&md5=9f38807a49c57b45dae67e172a81b9ff,"The final step of the typical process of developing educational and psychological tests is to place the selected test items in a formatted form. The step involves the grouping and ordering of the items to meet a variety of formatting constraints. As this activity tends to be time-intensive, the use of mixed-integer programming (MIP) has been proposed to automate it. The goal of this article is to show how constraint programming (CP) can be used as an alternative to automate test-form generation problems with a large variety of formatting constraints, and how it compares with MIP-based form generation as for its models, solutions, and running times. Two empirical examples are presented: (i) automated generation of a computerized fixed-form; and (ii) automated generation of shadow tests for multistage testing. Both examples show that CP works well with feasible solutions and running times likely to be better than that for MIP-based applications. © 2018 by the National Council on Measurement in Education",,,Article,Final,All Open Access; Green Open Access,Scopus,2-s2.0-85057533933
Ju U.; Falk C.F.,"Ju, Unhee (57201737714); Falk, Carl F. (26659012900)",57201737714; 26659012900,Modeling Response Styles in Cross-Country Self-Reports: An Application of a Multilevel Multidimensional Nominal Response Model,2019,Journal of Educational Measurement,56,1,,169,191,22,12,10.1111/jedm.12205,https://www.scopus.com/inward/record.uri?eid=2-s2.0-85062886743&doi=10.1111%2fjedm.12205&partnerID=40&md5=c6a46301a72141e21fa82557421f9c31,"We examined the feasibility and results of a multilevel multidimensional nominal response model (ML-MNRM) for measuring both substantive constructs and extreme response style (ERS) across countries. The ML-MNRM considers within-country clustering while allowing overall item slopes to vary across items and examination of whether certain items were more prone to ERS. We applied this model to survey items from TALIS 2013. Results indicated that self-efficacy items were more likely to trigger ERS compared to need for professional development, and the between-country relationships among constructs can change due to ERS. Simulations assessed the estimation approach and found adequate recovery of model parameters and factor scores. We stress the importance of additional validity studies to improve the cross-cultural comparability of substantive constructs. © 2019 by the National Council on Measurement in Education",,,Article,Final,,Scopus,2-s2.0-85062886743
Köhler C.; Pohl S.; Carstensen C.H.,"Köhler, Carmen (56819742200); Pohl, Steffi (23398048100); Carstensen, Claus H. (7005559444)",56819742200; 23398048100; 7005559444,Dealing With Item Nonresponse in Large-Scale Cognitive Assessments: The Impact of Missing Data Methods on Estimated Explanatory Relationships,2017,Journal of Educational Measurement,54,4,,397,419,22,22,10.1111/jedm.12154,https://www.scopus.com/inward/record.uri?eid=2-s2.0-85036552005&doi=10.1111%2fjedm.12154&partnerID=40&md5=36c646be0d751a56ef05e1df993c44b5,"Competence data from low-stakes educational large-scale assessment studies allow for evaluating relationships between competencies and other variables. The impact of item-level nonresponse has not been investigated with regard to statistics that determine the size of these relationships (e.g., correlations, regression coefficients). Classical approaches such as ignoring missing values or treating them as incorrect are currently applied in many large-scale studies, while recent model-based approaches that can account for nonignorable nonresponse have been developed. Estimates of item and person parameters have been demonstrated to be biased for classical approaches when missing data are missing not at random (MNAR). In our study, we focus on parameter estimates of the structural model (i.e., the true regression coefficient when regressing competence on an explanatory variable), simulating data according to various missing data mechanisms. We found that model-based approaches and ignoring missing values performed well in retrieving regression coefficients even when we induced missing data that were MNAR. Treating missing values as incorrect responses can lead to substantial bias. We demonstrate the validity of our approach empirically and discuss the relevance of our results. Copyright © 2017 by the National Council on Measurement in Education",,,Article,Final,All Open Access; Green Open Access,Scopus,2-s2.0-85036552005
Sinharay S.,"Sinharay, Sandip (6602980064)",6602980064,A New Interpretation of Augmented Subscores and Their Added Value in Terms of Parallel Forms,2018,Journal of Educational Measurement,55,2,,177,193,16,2,10.1111/jedm.12171,https://www.scopus.com/inward/record.uri?eid=2-s2.0-85048052573&doi=10.1111%2fjedm.12171&partnerID=40&md5=252bc152aafc772199482f90f29f982f,The value-added method of Haberman is arguably one of the most popular methods to evaluate the quality of subscores. The method is based on the classical test theory and deems a subscore to be of added value if the subscore predicts the corresponding true subscore better than does the total score. Sinharay provided an interpretation of the added value of subscores in terms of scores and subscores on parallel forms. This article extends the results of Sinharay and considers the prediction of a subscore on a parallel form from both the subscore and the total raw score on the original form. The resulting predictor essentially becomes the augmented subscore suggested by Haberman. The proportional reduction in mean squared error of the resulting predictor is interpreted as a squared multiple correlation coefficient. The practical usefulness of the derived results is demonstrated using an operational data set. Copyright © 2018 by the National Council on Measurement in Education,,,Article,Final,,Scopus,2-s2.0-85048052573
Fox J.-P.; Marianti S.,"Fox, Jean-Paul (7404280363); Marianti, Sukaesi (56454377800)",7404280363; 56454377800,Person-Fit Statistics for Joint Models for Accuracy and Speed,2017,Journal of Educational Measurement,54,2,,243,262,19,32,10.1111/jedm.12143,https://www.scopus.com/inward/record.uri?eid=2-s2.0-85020222032&doi=10.1111%2fjedm.12143&partnerID=40&md5=ca142c57e293cf66831f1f15dcea8ac9,"Response accuracy and response time data can be analyzed with a joint model to measure ability and speed of working, while accounting for relationships between item and person characteristics. In this study, person-fit statistics are proposed for joint models to detect aberrant response accuracy and/or response time patterns. The person-fit tests take the correlation between ability and speed into account, as well as the correlation between item characteristics. They are posited as Bayesian significance tests, which have the advantage that the extremeness of a test statistic value is quantified by a posterior probability. The person-fit tests can be computed as by-products of a Markov chain Monte Carlo algorithm. Simulation studies were conducted in order to evaluate their performance. For all person-fit tests, the simulation studies showed good detection rates in identifying aberrant patterns. A real data example is given to illustrate the person-fit statistics for the evaluation of the joint model. Copyright © 2017 by the National Council on Measurement in Education",,,Article,Final,All Open Access; Green Open Access,Scopus,2-s2.0-85020222032
Briggs D.C.; Chattergoon R.; Burkhardt A.,"Briggs, Derek C. (7202334195); Chattergoon, Rajendra (57203989892); Burkhardt, Amy (57210822324)",7202334195; 57203989892; 57210822324,Examining the Dual Purpose Use of Student Learning Objectives for Classroom Assessment and Teacher Evaluation,2019,Journal of Educational Measurement,56,4,,686,714,28,6,10.1111/jedm.12233,https://www.scopus.com/inward/record.uri?eid=2-s2.0-85071604207&doi=10.1111%2fjedm.12233&partnerID=40&md5=74b2af123e3f35c96f91b994f819b1ec,"The process of setting and evaluating student learning objectives (SLOs) has become increasingly popular as an example where classroom assessment is intended to fulfill the dual purpose use of informing instruction and holding teachers accountable. A concern is that the high-stakes purpose may lead to distortions in the inferences about students and teachers that SLOs can support. This concern is explored in the present study by contrasting student SLO scores in a large urban school district to performance on a common objective external criterion. This external criterion is used to evaluate the extent to which student growth scores appear to be inflated. Using 2 years of data, growth comparisons are also made at the teacher level for teachers who submit SLOs and have students that take the state-administered large-scale assessment. Although they do show similar relationships with demographic covariates and have the same degree of stability across years, the two different measures of growth are weakly correlated. © 2019 by the National Council on Measurement in Education",,,Article,Final,,Scopus,2-s2.0-85071604207
Steedle J.T.; Radunzel J.; Mattern K.D.,"Steedle, Jeffrey T. (14833599100); Radunzel, Justine (56544644800); Mattern, Krista D. (35956260000)",14833599100; 56544644800; 35956260000,Comparing Academic Readiness Requirements for Different Postsecondary Pathways: What Admissions Tests Tell Us,2019,Journal of Educational Measurement,56,2,,331,360,29,1,10.1111/jedm.12211,https://www.scopus.com/inward/record.uri?eid=2-s2.0-85066791985&doi=10.1111%2fjedm.12211&partnerID=40&md5=b3d55c511446e0f41ef51cea5c261830,"Ensuring postsecondary readiness is a goal of K-12 education, but it is unclear whether high school students should get different messages about the required levels of academic preparation depending on their postsecondary trajectories. This study estimated readiness benchmark scores on a college admissions test predictive of earning good grades in majors associated with middle-skills occupations at 2-year postsecondary institutions. Results generally indicated similarity between those scores, the corresponding scores for students preparing for high-skills jobs requiring a bachelor's degree, and established readiness benchmarks for the general college-going population. Subsequent analyses revealed small variation between readiness benchmarks for different college majors. Overall, results suggest that high school graduates need a strong academic foundation regardless of the postsecondary path they choose. © 2019 by the National Council on Measurement in Education",,,Article,Final,,Scopus,2-s2.0-85066791985
Sinharay S.,"Sinharay, Sandip (6602980064)",6602980064,How to Compare Parametric and Nonparametric Person-Fit Statistics Using Real Data,2017,Journal of Educational Measurement,54,4,,420,439,19,9,10.1111/jedm.12155,https://www.scopus.com/inward/record.uri?eid=2-s2.0-85036519035&doi=10.1111%2fjedm.12155&partnerID=40&md5=1c46e30e66cf58105b0a069ed561dfd6,"Person-fit assessment (PFA) is concerned with uncovering atypical test performance as reflected in the pattern of scores on individual items on a test. Existing person-fit statistics (PFSs) include both parametric and nonparametric statistics. Comparison of PFSs has been a popular research topic in PFA, but almost all comparisons have employed simulated data. This article suggests an approach for comparing the performance of parametric and nonparametric PFSs using real data. This article then shows that there is no clear winner between l*Z, a popular parametric PFS, and HT, a popular nonparametric statistic, in a comparison using the suggested approach. This finding is contradictory to the common finding shown by Karabatsos, Dimitrov and Smith, and Tendeiro and Meijer that HT is more powerful than several parametric PFSs including l*Z and lZ. Copyright © 2017 by the National Council on Measurement in Education",,,Article,Final,,Scopus,2-s2.0-85036519035
Wind S.A.,"Wind, Stefanie A. (55616798300)",55616798300,"Nonparametric Evidence of Validity, Reliability, and Fairness for Rater-Mediated Assessments: An Illustration Using Mokken Scale Analysis",2019,Journal of Educational Measurement,56,3,,478,504,26,5,10.1111/jedm.12222,https://www.scopus.com/inward/record.uri?eid=2-s2.0-85069683166&doi=10.1111%2fjedm.12222&partnerID=40&md5=b12831103a777744c1db6d1fb73c776a,"Numerous researchers have proposed methods for evaluating the quality of rater-mediated assessments using nonparametric methods (e.g., kappa coefficients) and parametric methods (e.g., the many-facet Rasch model). Generally speaking, popular nonparametric methods for evaluating rating quality are not based on a particular measurement theory. On the other hand, popular parametric methods for evaluating rating quality are often based on measurement theories such as invariant measurement. However, these methods are based on assumptions and transformations that may not be appropriate for ordinal ratings. In this study, I show how researchers can use Mokken scale analysis (MSA), which is a nonparametric approach to item response theory, to evaluate rating quality within the framework of invariant measurement without the use of potentially inappropriate parametric techniques. I use an illustrative analysis of data from a rater-mediated writing assessment to demonstrate how one can use numeric and graphical indicators from MSA to gather evidence of validity, reliability, and fairness. The results from the analyses suggest that MSA provides a useful framework within which to evaluate rater-mediated assessments for evidence of validity, reliability, and fairness that can supplement existing popular methods for evaluating ratings. © 2019 by the National Council on Measurement in Education",,,Article,Final,,Scopus,2-s2.0-85069683166
