Authors,Author full names,Author(s) ID,Title,Year,Source title,Volume,Issue,Art. No.,Page start,Page end,Page count,Cited by,DOI,Link,Abstract,Author Keywords,Index Keywords,Document Type,Publication Stage,Open Access,Source,EID
Wang W.; Song L.; Chen P.; Meng Y.; Ding S.,"Wang, Wenyi (55241351300); Song, Lihong (55241908300); Chen, Ping (56975615100); Meng, Yaru (56992012300); Ding, Shuliang (23388404600)",55241351300; 55241908300; 56975615100; 56992012300; 23388404600,Attribute-Level and Pattern-Level Classification Consistency and Accuracy Indices for Cognitive Diagnostic Assessment,2015,Journal of Educational Measurement,52,4,,457,476,19,44,10.1111/jedm.12096,https://www.scopus.com/inward/record.uri?eid=2-s2.0-84949224418&doi=10.1111%2fjedm.12096&partnerID=40&md5=b403387adb3c32820af14c352762756f,"Classification consistency and accuracy are viewed as important indicators for evaluating the reliability and validity of classification results in cognitive diagnostic assessment (CDA). Pattern-level classification consistency and accuracy indices were introduced by Cui, Gierl, and Chang. However, the indices at the attribute level have not yet been constructed. This study puts forward a simple approach to estimating the indices at both the attribute and the pattern level through one single test administration. Detailed elaboration is made on how the upper and lower bounds for the attribute-level accuracy can be derived from the variance of error of the attribute mastery probability estimate. In addition, based on Cui's pattern-level indices, an alternative approach to estimating the attribute-level indices is also proposed. Comparative analysis of simulation results indicate that the new indices are very desirable for evaluating test-retest consistency and correct classification rate. © 2015 by the National Council on Measurement in Education.",,,Article,Final,,Scopus,2-s2.0-84949224418
Belov D.I.,"Belov, Dmitry I. (8355735900)",8355735900,Robust Detection of Examinees With Aberrant Answer Changes,2015,Journal of Educational Measurement,52,4,,437,456,19,7,10.1111/jedm.12094,https://www.scopus.com/inward/record.uri?eid=2-s2.0-84949189889&doi=10.1111%2fjedm.12094&partnerID=40&md5=ff63277f08df0259ccedd4c777198456,"The statistical analysis of answer changes (ACs) has uncovered multiple testing irregularities on large-scale assessments and is now routinely performed at testing organizations. However, AC data has an uncertainty caused by technological or human factors. Therefore, existing statistics (e.g., number of wrong-to-right ACs) used to detect examinees with aberrant ACs capitalize on the uncertainty, which may result in a large Type I error. In this article, the information about ACs is used only for the partitioning of administered items into two disjoint subtests: items where ACs did not occur, and items where ACs did occur. A new statistic is based on the difference in performance between these subtests (measured as Kullback-Leibler divergence between corresponding posteriors of latent traits), where, in order to avoid the uncertainty, only final responses are used. One of the subtests can be filtered such that the asymptotic distribution of the statistic is chi-square with one degree of freedom. In computer simulations, the presented statistic demonstrated a strong robustness to the uncertainty and higher detection rates in contrast to two popular statistics based on wrong-to-right ACs. © 2015 by the National Council on Measurement in Education.",,,Article,Final,All Open Access; Bronze Open Access,Scopus,2-s2.0-84949189889
Kim S.,"Kim, Seonghoon (23060961000)",23060961000,Generalization of the Lord-Wingersky algorithm to computing the distribution of summed test scores based on real-number item scores,2013,Journal of Educational Measurement,50,4,,381,389,8,3,10.1111/jedm.12024,https://www.scopus.com/inward/record.uri?eid=2-s2.0-84892843511&doi=10.1111%2fjedm.12024&partnerID=40&md5=813c4fd01f0944e62a7868277e6d958e,"With known item response theory (IRT) item parameters, Lord and Wingersky provided a recursive algorithm for computing the conditional frequency distribution of number-correct test scores, given proficiency. This article presents a generalized algorithm for computing the conditional distribution of summed test scores involving real-number item scores. The generalized algorithm is distinct from the Lord-Wingersky algorithm in that it explicitly incorporates the task of figuring out all possible unique real-number test scores in each recursion. Some applications of the generalized recursive algorithm, such as IRT test score reliability estimation and IRT proficiency estimation based on summed test scores, are illustrated with a short test by varying scoring schemes for its items. © 2013 by the National Council on Measurement in Education.",,,Article,Final,,Scopus,2-s2.0-84892843511
Wiberg M.; Van Der Linden W.J.; Von Davier A.A.,"Wiberg, Marie (7006479952); Van Der Linden, Wim J. (55409657500); Von Davier, Alina A. (6506976799)",7006479952; 55409657500; 6506976799,Local observed-score kernel equating,2014,Journal of Educational Measurement,51,1,,57,74,17,15,10.1111/jedm.12034,https://www.scopus.com/inward/record.uri?eid=2-s2.0-84896911930&doi=10.1111%2fjedm.12034&partnerID=40&md5=a4a3e58060db3a3dd751364d8bc21299,"Three local observed-score kernel equating methods that integrate methods from the local equating and kernel equating frameworks are proposed. The new methods were compared with their earlier counterparts with respect to such measures as bias-as defined by Lord's criterion of equity-and percent relative error. The local kernel item response theory observed-score equating method, which can be used for any of the common equating designs, had a small amount of bias, a low percent relative error, and a relatively low kernel standard error of equating, even when the accuracy of the test was reduced. The local kernel equating methods for the nonequivalent groups with anchor test generally had low bias and were quite stable against changes in the accuracy or length of the anchor test. Although all proposed methods showed small percent relative errors, the local kernel equating methods for the nonequivalent groups with anchor test design had somewhat larger standard error of equating than their kernel method counterparts. © 2014 by the National Council on Measurement in Education.",,,Article,Final,All Open Access; Green Open Access,Scopus,2-s2.0-84896911930
Puhan G.,"Puhan, Gautam (12445769400)",12445769400,Choosing Among Tucker or Chained Linear Equating in Two Testing Situations: Rater Comparability Scoring and Randomly Equivalent Groups With an Anchor,2012,Journal of Educational Measurement,49,3,,312,329,17,4,10.1111/j.1745-3984.2012.00177.x,https://www.scopus.com/inward/record.uri?eid=2-s2.0-84866393262&doi=10.1111%2fj.1745-3984.2012.00177.x&partnerID=40&md5=ef833f1b51f00d1bed34b8ce52906e83,"Tucker and chained linear equatings were evaluated in two testing scenarios. In Scenario 1, referred to as rater comparability scoring and equating, the anchor-to-total correlation is often very high for the new form but moderate for the reference form. This may adversely affect the results of Tucker equating, especially if the new and reference form samples differ in ability. In Scenario 2, the new and reference form samples are randomly equivalent but the correlation between the anchor and total scores is low. When the correlation between the anchor and total scores is low, Tucker equating assumes that the new and reference form samples are similar in ability (which, with randomly equivalents groups, is the correct assumption). Thus Tucker equating should produce accurate results. Results indicated that in Scenario 1, the Tucker results were less accurate than the chained linear equating results. However, in Scenario 2, the Tucker results were more accurate than the chained linear equating results. Some implications are discussed. © 2012 by the National Council on Measurement in Education.",,,Article,Final,,Scopus,2-s2.0-84866393262
French B.F.; Finch W.H.,"French, Brian F. (7102910290); Finch, W. Holmes (12767650300)",7102910290; 12767650300,Transforming SIBTEST to Account for Multilevel Data Structures,2015,Journal of Educational Measurement,52,2,,159,180,21,6,10.1111/jedm.12071,https://www.scopus.com/inward/record.uri?eid=2-s2.0-84930176185&doi=10.1111%2fjedm.12071&partnerID=40&md5=e69ca2f16bdbd98e8b21d935e92add27,"SIBTEST is a differential item functioning (DIF) detection method that is accurate and effective with small samples, in the presence of group mean differences, and for assessment of both uniform and nonuniform DIF. The presence of multilevel data with DIF detection has received increased attention. Ignoring such structure can inflate Type I error. This simulation study examines the performance of newly developed multilevel adaptations of SIBTEST in the presence of multilevel data. Data were simulated in a multilevel framework and both uniform and nonuniform DIF were assessed. Study results demonstrated that naïve SIBTEST and Crossing SIBTEST, ignoring the multilevel data structure, yield inflated Type I error rates, while certain multilevel extensions provided better error and accuracy control. © 2015 by the National Council on Measurement in Education.",,,Article,Final,,Scopus,2-s2.0-84930176185
Chen H.,"Chen, Haiwen (36093884700)",36093884700,A Comparison Between Linear IRT Observed-Score Equating and Levine Observed-Score Equating Under the Generalized Kernel Equating Framework,2012,Journal of Educational Measurement,49,3,,269,284,15,6,10.1111/j.1745-3984.2012.00175.x,https://www.scopus.com/inward/record.uri?eid=2-s2.0-84866373825&doi=10.1111%2fj.1745-3984.2012.00175.x&partnerID=40&md5=7e44d387191b2bcb6c283830affcb297,"In this article, linear item response theory (IRT) observed-score equating is compared under a generalized kernel equating framework with Levine observed-score equating for nonequivalent groups with anchor test design. Interestingly, these two equating methods are closely related despite being based on different methodologies. Specifically, when using data from IRT models, linear IRT observed-score equating is virtually identical to Levine observed-score equating. This leads to the conclusion that poststratification equating based on true anchor scores can be viewed as the curvilinear Levine observed-score equating. © 2012 by the National Council on Measurement in Education.",,,Article,Final,,Scopus,2-s2.0-84866373825
Andersson B.; von Davier A.A.,"Andersson, Björn (7401941749); von Davier, Alina A. (6506976799)",7401941749; 6506976799,Improving the bandwidth selection in kernel equating,2014,Journal of Educational Measurement,51,3,,223,238,15,9,10.1111/jedm.12044,https://www.scopus.com/inward/record.uri?eid=2-s2.0-84906761569&doi=10.1111%2fjedm.12044&partnerID=40&md5=405c2d7dc88ea958a4d5e868f44d145b,"We investigate the current bandwidth selection methods in kernel equating and propose a method based on Silverman's rule of thumb for selecting the bandwidth parameters. In kernel equating, the bandwidth parameters have previously been obtained by minimizing a penalty function. This minimization process has been criticized by practitioners for being too complex and that it does not offer sufficient smoothing in certain cases. In addition, the bandwidth parameters have been treated as constants in the derivation of the standard error of equating even when they were selected by considering the observed data. Here, the bandwidth selection is simplified, and modified standard errors of equating (SEEs) that reflect the bandwidth selection method are derived. The method is illustrated with real data examples and simulated data. © 2014 by the National Council on Measurement in Education.",,,Article,Final,All Open Access; Bronze Open Access,Scopus,2-s2.0-84906761569
Li F.; Cohen A.; Shen L.,"Li, Feiming (35097408700); Cohen, Allan (55465451100); Shen, Linjun (57149371900)",35097408700; 55465451100; 57149371900,Investigating the Effect of Item Position in Computer-Based Tests,2012,Journal of Educational Measurement,49,4,,362,379,17,11,10.1111/j.1745-3984.2012.00181.x,https://www.scopus.com/inward/record.uri?eid=2-s2.0-84871693140&doi=10.1111%2fj.1745-3984.2012.00181.x&partnerID=40&md5=01428d02820351c194a458dfb6a24052,"Computer-based tests (CBTs) often use random ordering of items in order to minimize item exposure and reduce the potential for answer copying. Little research has been done, however, to examine item position effects for these tests. In this study, different versions of a Rasch model and different response time models were examined and applied to data from a CBT administration of a medical licensure examination. The models specifically were used to investigate whether item position affected item difficulty and item intensity estimates. Results indicated that the position effect was negligible. © 2012 by the National Council on Measurement in Education.",,,Article,Final,,Scopus,2-s2.0-84871693140
Sachse K.A.; Roppelt A.; Haag N.,"Sachse, Karoline A. (57193549524); Roppelt, Alexander (56126319000); Haag, Nicole (55778405300)",57193549524; 56126319000; 55778405300,A Comparison of Linking Methods for Estimating National Trends in International Comparative Large-Scale Assessments in the Presence of Cross-National DIF,2016,Journal of Educational Measurement,53,2,,152,171,19,15,10.1111/jedm.12106,https://www.scopus.com/inward/record.uri?eid=2-s2.0-85014746158&doi=10.1111%2fjedm.12106&partnerID=40&md5=238570ae894203c529f9211ad55f1a3a,"Trend estimation in international comparative large-scale assessments relies on measurement invariance between countries. However, cross-national differential item functioning (DIF) has been repeatedly documented. We ran a simulation study using national item parameters, which required trends to be computed separately for each country, to compare trend estimation performances to two linking methods employing international item parameters across several conditions. The trend estimates based on the national item parameters were more accurate than the trend estimates based on the international item parameters when cross-national DIF was present. Moreover, the use of fixed common item parameter calibrations led to biased trend estimates. The detection and elimination of DIF can reduce this bias but is also likely to increase the total error. Copyright © 2016 by the National Council on Measurement in Education",,,Article,Final,,Scopus,2-s2.0-85014746158
Shu L.; Schwarz R.D.,"Shu, Lianghua (54413095700); Schwarz, Richard D. (7401845696)",54413095700; 7401845696,IRT-estimated reliability for tests containing mixed item formats,2014,Journal of Educational Measurement,51,2,,163,177,14,4,10.1111/jedm.12040,https://www.scopus.com/inward/record.uri?eid=2-s2.0-84902254318&doi=10.1111%2fjedm.12040&partnerID=40&md5=8410ebcdee85105aa674d8836e858c59,"As a global measure of precision, item response theory (IRT) estimated reliability is derived for four coefficients (Cronbach's α, Feldt-Raju, stratified α, and marginal reliability). Models with different underlying assumptions concerning test-part similarity are discussed. A detailed computational example is presented for the targeted coefficients. A comparison of the IRT model-derived coefficients is made and the impact of varying ability distributions is evaluated. The advantages of IRT-derived reliability coefficients for problems such as automated test form assembly and vertical scaling are discussed. © 2014 by the National Council on Measurement in Education.",,,Article,Final,,Scopus,2-s2.0-84902254318
Haberman S.; Yao L.,"Haberman, Shelby (14048312500); Yao, Lili (56594140400)",14048312500; 56594140400,Repeater Analysis for Combining Information From Different Assessments,2015,Journal of Educational Measurement,52,2,,223,251,28,15,10.1111/jedm.12075,https://www.scopus.com/inward/record.uri?eid=2-s2.0-84930162475&doi=10.1111%2fjedm.12075&partnerID=40&md5=fe54516b8fca15354b6bd83a6b318b17,"Admission decisions frequently rely on multiple assessments. As a consequence, it is important to explore rational approaches to combine the information from different educational tests. For example, U.S. graduate schools usually receive both TOEFL iBT® scores and GRE® General scores of foreign applicants for admission; however, little guidance has been given to combine information from these two assessments, even though the relationships between such sections as GRE Verbal and TOEFL iBT Reading are obvious. In this study, principles are provided to explore the extent to which different assessments complement one another and are distinguishable. Augmentation approaches developed for individual tests are applied to provide an accurate evaluation of combined assessments. Because augmentation methods require estimates of measurement error and internal reliability data are unavailable, required estimates of measurement error are obtained from repeaters, examinees who took the same test more than once. Because repeaters are not representative of all examinees in typical assessments, minimum discriminant information adjustment techniques are applied to the available sample of repeaters to treat the effect of selection bias. To illustrate methodology, combining information from TOEFL iBT scores and GRE General scores is examined. Analysis suggests that information from the GRE General and TOEFL iBT assessments is complementary but not redundant, indicating that the two tests measure related but somewhat different constructs. The proposed methodology can be readily applied to other situations where multiple assessments are needed. © 2015 by the National Council on Measurement in Education.",,,Article,Final,,Scopus,2-s2.0-84930162475
Wang C.; Zheng C.; Chang H.-H.,"Wang, Chun (15924354400); Zheng, Chanjin (56438512800); Chang, Hua-Hua (7407524642)",15924354400; 56438512800; 7407524642,An Enhanced Approach to Combine Item Response Theory With Cognitive Diagnosis in Adaptive Testing,2014,Journal of Educational Measurement,51,4,,358,380,22,23,10.1111/jedm.12057,https://www.scopus.com/inward/record.uri?eid=2-s2.0-84915782970&doi=10.1111%2fjedm.12057&partnerID=40&md5=74cd1faa24bda4a2e20beadd9cee253b,"Computerized adaptive testing offers the possibility of gaining information on both the overall ability and cognitive profile in a single assessment administration. Some algorithms aiming for these dual purposes have been proposed, including the shadow test approach, the dual information method (DIM), and the constraint weighted method. The current study proposed two new methods, aggregate ranked information index (ARI) and aggregate standardized information index (ASI), which appropriately addressed the noncompatibility issue inherent in the original DIM method. More flexible weighting schemes that put different emphasis on information about general ability (i.e., θ in item response theory) and information about cognitive profile (i.e., α in cognitive diagnostic modeling) were also explored. Two simulation studies were carried out to investigate the effectiveness of the new methods and weighting schemes. Results showed that the new methods with the flexible weighting schemes could produce more accurate estimation of both overall ability and cognitive profile than the original DIM. Among them, the ASI with both empirical and theoretical weights is recommended, and attribute-level weighting scheme is preferred if some attributes are considered more important from a substantive perspective. © 2014 by the National Council on Measurement in Education.",,,Article,Final,,Scopus,2-s2.0-84915782970
Debeer D.; Janssen R.,"Debeer, Dries (55765500900); Janssen, Rianne (7202677512)",55765500900; 7202677512,Modeling item-position effects within an IRT framework,2013,Journal of Educational Measurement,50,2,,164,185,21,73,10.1111/jedm.12009,https://www.scopus.com/inward/record.uri?eid=2-s2.0-84879018856&doi=10.1111%2fjedm.12009&partnerID=40&md5=ef6fb3b2a796310391d7cfb0a6537276,"Changing the order of items between alternate test forms to prevent copying and to enhance test security is a common practice in achievement testing. However, these changes in item order may affect item and test characteristics. Several procedures have been proposed for studying these item-order effects. The present study explores the use of descriptive and explanatory models from item response theory for detecting and modeling these effects in a one-step procedure. The framework also allows for consideration of the impact of individual differences in position effect on item difficulty. A simulation was conducted to investigate the impact of a position effect on parameter recovery in a Rasch model. As an illustration, the framework was applied to a listening comprehension test for French as a foreign language and to data from the PISA 2006 assessment.Copyright © 2013 by the National Council on Measurement in Education.",,,Article,Final,,Scopus,2-s2.0-84879018856
Kane M.T.,"Kane, Michael T. (36088969800)",36088969800,"Validation as a Pragmatic, Scientific Activity",2013,Journal of Educational Measurement,50,1,,115,122,7,64,10.1111/jedm.12007,https://www.scopus.com/inward/record.uri?eid=2-s2.0-84875058768&doi=10.1111%2fjedm.12007&partnerID=40&md5=bf613c4c33caf90875ef8ea29e5d5163,"This response to the comments contains three main sections, each addressing a subset of the comments. In the first section, I will respond to the comments by Brennan, Haertel, and Moss. All of these comments suggest ways in which my presentation could be extended or improved; I generally agree with their suggestions, so my response to their comments is brief. In the second section, I will respond to suggestions by Newton and Sireci that my framework be simplified by employing only one kind of argument, a validity argument, and dropping the interpretation/use argument (IUA); I am sympathetic to their desire for greater simplicity, but I see considerable value in keeping the IUA as a framework for the validation effort and will argue for keeping both the IUA and the validity argument. In the third section, I will respond to Borsboom and Markus, who raise a fundamental objection to my approach to validation, suggesting that I give too much attention to justification and too little to truth as a criterion for validity; I don't accept their proposed conception of validity, and I will indicate why. © 2013 by the National Council on Measurement in Education.",,,Article,Final,,Scopus,2-s2.0-84875058768
Ranger J.; Kuhn J.-T.,"Ranger, Jochen (37049459900); Kuhn, Jörg-Tobias (7201531071)",37049459900; 7201531071,Assessing Fit of Item Response Models Using the Information Matrix Test,2012,Journal of Educational Measurement,49,3,,247,268,21,14,10.1111/j.1745-3984.2012.00174.x,https://www.scopus.com/inward/record.uri?eid=2-s2.0-84866428881&doi=10.1111%2fj.1745-3984.2012.00174.x&partnerID=40&md5=1543b5b95979cff176f312ce679d8561,"The information matrix can equivalently be determined via the expectation of the Hessian matrix or the expectation of the outer product of the score vector. The identity of these two matrices, however, is only valid in case of a correctly specified model. Therefore, differences between the two versions of the observed information matrix indicate model misfit. The equality of both matrices can be tested with the so-called information matrix test as a general test of misspecification. This test can be adapted to item response models in order to evaluate the fit of single items and the fit of the whole scale. The performance of different versions of the test is compared in a simulation study with existing tests of model fit, among them thetest of Orlando and Thissen, the score test of local independence due to Glas and Suarez-Falcon, and the limited information approach of Maydeu-Olivares and Joe. In general, the different versions of the information matrix test adhere to the nominal Type I error rate and have high power for detecting misspecified item characteristic curves. Additionally, some versions of the test can be used in order to detect violations of the local independence assumption. © 2012 by the National Council on Measurement in Education.",,,Article,Final,,Scopus,2-s2.0-84866428881
Moses T.,"Moses, Tim (12243516500)",12243516500,Relationships of measurement error and prediction error in observed-score regression,2012,Journal of Educational Measurement,49,4,,380,398,18,6,10.1111/j.1745-3984.2012.00182.x,https://www.scopus.com/inward/record.uri?eid=2-s2.0-84871689459&doi=10.1111%2fj.1745-3984.2012.00182.x&partnerID=40&md5=7673f4026980d49fbbbcf8d4bcb3cb0a,The focus of this paper is assessing the impact of measurement errors on the prediction error of an observed-score regression. Measures are presented and described for decomposing the linear regression's prediction error variance into parts attributable to the true score variance and the error variances of the dependent variable and the predictor variable(s). These measures are demonstrated for regression situations reflecting a range of true score correlations and reliabilities and using one and two predictors. Simulation results also are presented which show that the measures of prediction error variance and its parts are generally well estimated for the considered ranges of true score correlations and reliabilities and for homoscedastic and heteroscedastic data. The final discussion considers how the decomposition might be useful for addressing additional questions about regression functions' prediction error variances. © 2012 by the National Council on Measurement in Education.,,,Article,Final,,Scopus,2-s2.0-84871689459
