Authors,Author full names,Author(s) ID,Title,Year,Source title,Volume,Issue,Art. No.,Page start,Page end,Page count,Cited by,DOI,Link,Abstract,Author Keywords,Index Keywords,Document Type,Publication Stage,Open Access,Source,EID
Jiao H.; Wang S.; He W.,"Jiao, Hong (55155258600); Wang, Shudong (7410345992); He, Wei (55497177600)",55155258600; 7410345992; 55497177600,Estimation methods for one-parameter testlet models,2013,Journal of Educational Measurement,50,2,,186,203,17,13,10.1111/jedm.12010,https://www.scopus.com/inward/record.uri?eid=2-s2.0-84879010269&doi=10.1111%2fjedm.12010&partnerID=40&md5=bb63fc769f764244f84d4dc55d891527,"This study demonstrated the equivalence between the Rasch testlet model and the three-level one-parameter testlet model and explored the Markov Chain Monte Carlo (MCMC) method for model parameter estimation in WINBUGS. The estimation accuracy from the MCMC method was compared with those from the marginalized maximum likelihood estimation (MMLE) with the expectation-maximization algorithm in ConQuest and the sixth-order Laplace approximation estimation in HLM6. The results indicated that the estimation methods had significant effects on the bias of the testlet variance and ability variance estimation, the random error in the ability parameter estimation, and the bias in the item difficulty parameter estimation. The Laplace method best recovered the testlet variance while the MMLE best recovered the ability variance. The Laplace method resulted in the smallest random error in the ability parameter estimation while the MCMC method produced the smallest bias in item parameter estimates. Analyses of three real tests generally supported the findings from the simulation and indicated that the estimates for item difficulty and ability parameters were highly correlated across estimation methods. Copyright © 2013 by the National Council on Measurement in Education.",,,Article,Final,,Scopus,2-s2.0-84879010269
Falk C.F.; Cai L.,"Falk, Carl F. (26659012900); Cai, Li (28267556400)",26659012900; 28267556400,Semiparametric Item Response Functions in the Context of Guessing,2016,Journal of Educational Measurement,53,2,,229,247,18,12,10.1111/jedm.12111,https://www.scopus.com/inward/record.uri?eid=2-s2.0-85035072452&doi=10.1111%2fjedm.12111&partnerID=40&md5=5754e0e67710a638e5fdf8bc3fcf862e,"We present a logistic function of a monotonic polynomial with a lower asymptote, allowing additional flexibility beyond the three-parameter logistic model. We develop a maximum marginal likelihood-based approach to estimate the item parameters. The new item response model is demonstrated on math assessment data from a state, and a computationally efficient strategy for choosing the order of the polynomial is demonstrated. Finally, our approach is tested through simulations and compared to response function estimation using smoothed isotonic regression. Results indicate that our approach can result in small gains in item response function recovery and latent trait estimation. Copyright © 2016 by the National Council on Measurement in Education",,,Article,Final,,Scopus,2-s2.0-85035072452
Von Davier M.; B. J.G.; von Davier A.A.,"Von Davier, Matthias (6506084822); B., Jorge González (55450693300); von Davier, Alina A. (6506976799)",6506084822; 55450693300; 6506976799,"Local equating using the rasch model, the OPLM, and the 2PL IRT model-or-what is it anyway if the model captures everything there is to know about the test takers?",2013,Journal of Educational Measurement,50,3,,295,303,8,8,10.1111/jedm.12016,https://www.scopus.com/inward/record.uri?eid=2-s2.0-84890885567&doi=10.1111%2fjedm.12016&partnerID=40&md5=e8554196745936895fe7c1e9c9de29c5,"Local equating (LE) is based on Lord's criterion of equity. It defines a family of true transformations that aim at the ideal of equitable equating. van der Linden (this issue) offers a detailed discussion of common issues in observed-score equating relative to this local approach. By assuming an underlying item response theory model, one of the main features of LE is that it adjusts the equated raw scores using conditional distributions of raw scores given an estimate of the ability of interest. In this article, we argue that this feature disappears when using a Rasch model for the estimation of the true transformation, while the one-parameter logistic model and the two-parameter logistic model do provide a local adjustment of the equated score. © 2013 by the National Council on Measurement in Education.",,,Article,Final,,Scopus,2-s2.0-84890885567
"Davison M.L.; Davenport E.C., Jr.; Chang Y.-F.; Vue K.; Su S.","Davison, Mark L. (7101919029); Davenport, Ernest C. (7006557222); Chang, Yu-Feng (56029111100); Vue, Kory (56819115700); Su, Shiyang (57201477790)",7101919029; 7006557222; 56029111100; 56819115700; 57201477790,Criterion-Related Validity: Assessing the Value of Subscores,2015,Journal of Educational Measurement,52,3,,263,279,16,13,10.1111/jedm.12081,https://www.scopus.com/inward/record.uri?eid=2-s2.0-84940838639&doi=10.1111%2fjedm.12081&partnerID=40&md5=f584c7339942e3af4c58095a907de552,"Criterion-related profile analysis (CPA) can be used to assess whether subscores of a test or test battery account for more criterion variance than does a single total score. Application of CPA to subscore evaluation is described, compared to alternative procedures, and illustrated using SAT data. Considerations other than validity and reliability are discussed, including broad societal goals (e.g., affirmative action), fairness, and ties in expected criterion predictions. In simulation data, CPA results were sensitive to subscore correlations, sample size, and the proportion of criterion-related variance accounted for by the subscores. CPA can be a useful component in a thorough subscore evaluation encompassing subscore reliability, validity, distinctiveness, fairness, and broader societal goals. © 2015 by the National Council on Measurement in Education.",,,Article,Final,,Scopus,2-s2.0-84940838639
Clauser J.C.; Margolis M.J.; Clauser B.E.,"Clauser, Jerome C. (56002327600); Margolis, Melissa J. (7101753505); Clauser, Brian E. (7003595460)",56002327600; 7101753505; 7003595460,An examination of the replicability of angoff standard setting results within a generalizability theory framework,2014,Journal of Educational Measurement,51,2,,127,140,13,17,10.1111/jedm.12038,https://www.scopus.com/inward/record.uri?eid=2-s2.0-84902248988&doi=10.1111%2fjedm.12038&partnerID=40&md5=675a213e6e2bd30130d5595437fa955d,"Evidence of stable standard setting results over panels or occasions is an important part of the validity argument for an established cut score. Unfortunately, due to the high cost of convening multiple panels of content experts, standards often are based on the recommendation from a single panel of judges. This approach implicitly assumes that the variability across panels will be modest, but little evidence is available to support this assertion. This article examines the stability of Angoff standard setting results across panels. Data were collected for six independent standard setting exercises, with three panels participating in each exercise. The results show that although in some cases the panel effect is negligible, for four of the six data sets the panel facet represented a large portion of the overall error variance. Ignoring the often hidden panel/occasion facet can result in artificially optimistic estimates of the cut score stability. Results based on a single panel should not be viewed as a reasonable estimate of the results that would be found over multiple panels. Instead, the variability seen in a single panel can best be viewed as a lower bound of the expected variability when the exercise is replicated. © 2014 by the National Board of Medical Examiners.",,,Article,Final,,Scopus,2-s2.0-84902248988
Wang W.-C.; Jin K.-Y.; Qiu X.-L.; Wang L.,"Wang, Wen-Chung (7501757876); Jin, Kuan-Yu (35388583700); Qiu, Xue-Lan (55540600800); Wang, Lei (58744454000)",7501757876; 35388583700; 55540600800; 58744454000,Item response models for examinee-selected items,2012,Journal of Educational Measurement,49,4,,419,445,26,8,10.1111/j.1745-3984.2012.00184.x,https://www.scopus.com/inward/record.uri?eid=2-s2.0-84871679296&doi=10.1111%2fj.1745-3984.2012.00184.x&partnerID=40&md5=191b495cf765748632f6780048e2eec3,"In some tests, examinees are required to choose a fixed number of items from a set of given items to answer. This practice creates a challenge to standard item response models, because more capable examinees may have an advantage by making wiser choices. In this study, we developed a new class of item response models to account for the choice effect of examinee-selected items. The results of a series of simulation studies showed: (1) that the parameters of the new models were recovered well, (2) the parameter estimates were almost unbiased when the new models were fit to data that were simulated from standard item response models, (3) failing to consider the choice effect yielded shrunken parameter estimates for examinee-selected items, and (4) even when the missingness mechanism in examinee-selected items did not follow the item response functions specified in the new models, the new models still yielded a better fit than did standard item response models. An empirical example of a college entrance examination supported the use of the new models: in general, the higher the examinee's ability, the better his or her choice of items. © 2012 by the National Council on Measurement in Education.",,,Article,Final,,Scopus,2-s2.0-84871679296
van der Palm D.W.; van der Ark L.A.; Sijtsma K.,"van der Palm, Daniël W. (40462680100); van der Ark, L. Andries (6602260003); Sijtsma, Klaas (7004185286)",40462680100; 6602260003; 7004185286,A Flexible Latent Class Approach to Estimating Test-Score Reliability,2014,Journal of Educational Measurement,51,4,,339,357,18,4,10.1111/jedm.12053,https://www.scopus.com/inward/record.uri?eid=2-s2.0-84915737516&doi=10.1111%2fjedm.12053&partnerID=40&md5=08bbd95723728f3f0207610218e241ad,"The latent class reliability coefficient (LCRC) is improved by using the divisive latent class model instead of the unrestricted latent class model. This results in the divisive latent class reliability coefficient (DLCRC), which unlike LCRC avoids making subjective decisions about the best solution and thus avoids judgment error. A computational study using large numbers of items shows that DLCRC also is faster than LCRC and fast enough for practical purposes. Speed and objectivity render DLCRC superior to LCRC. A decisive feature of DLCRC is that it aims at closely approximating the multivariate distribution of item scores, which might render the method suited when test data are multidimensional. A simulation study focusing on multidimensionality shows that DLCRC in general has little bias relative to the true reliability and is relatively accurate compared to LCRC and classical lower bound methods coefficients α and λ2 and the greatest lower bound. © 2014 by the National Council on Measurement in Education.",,,Article,Final,All Open Access; Green Open Access,Scopus,2-s2.0-84915737516
Haertel E.,"Haertel, Edward (6602745554)",6602745554,Getting the Help We Need,2013,Journal of Educational Measurement,50,1,,84,90,6,17,10.1111/jedm.12002,https://www.scopus.com/inward/record.uri?eid=2-s2.0-84875082266&doi=10.1111%2fjedm.12002&partnerID=40&md5=ed9e7d6a448ab9aaf3458998911e2af5,"In validating uses of testing, it is helpful to distinguish those that rely directly on the information provided by scores or score distributions (direct uses and consequences) versus those that instead capitalize on the motivational effects of testing, or use testing and test reporting to shape public opinion (indirect uses and consequences). Some uses and consequences, both direct and indirect, are intended; others are unintended. Unintended consequences pose greater challenges in test validation because they must be identified before they can be investigated. Validation of uses and consequences can employ theories and methods from various social science disciplines. Educational measurement is most closely allied with psychology and statistics, but sociologists, anthropologists, economists, linguists, and others also could help in theorizing and investigating the consequences of test use, especially indirect and unintended consequences. © 2013 by the National Council on Measurement in Education.",,,Article,Final,,Scopus,2-s2.0-84875082266
Cher Wong C.,"Cher Wong, Cheow (56541740900)",56541740900,Asymptotic standard errors for item response theory true score equating of polytomous items,2015,Journal of Educational Measurement,52,1,,106,120,14,8,10.1111/jedm.12065,https://www.scopus.com/inward/record.uri?eid=2-s2.0-84924284423&doi=10.1111%2fjedm.12065&partnerID=40&md5=c794deacbc89cc73774cbe3f16e892e8,"Building on previous works by Lord and Ogasawara for dichotomous items, this article proposes an approach to derive the asymptotic standard errors of item response theory true score equating involving polytomous items, for equivalent and nonequivalent groups of examinees. This analytical approach could be used in place of empirical methods like the bootstrap method, to obtain standard errors of equated scores. Formulas are introduced to obtain the derivatives for computing the asymptotic standard errors. The approach was validated using mean-mean, mean-sigma, random-groups, or concurrent calibration equating of simulated samples, for tests modeled using the generalized partial credit model or the graded response model. © 2015 by the National Council on Measurement in Education.",,,Article,Final,,Scopus,2-s2.0-84924284423
Mislevy R.J.; Zwick R.,"Mislevy, Robert J. (6701800690); Zwick, Rebecca (7004200859)",6701800690; 7004200859,"Scaling, Linking, and Reporting a Periodic Assessment System",2012,Journal of Educational Measurement,49,2,,148,166,18,7,10.1111/j.1745-3984.2012.00166.x,https://www.scopus.com/inward/record.uri?eid=2-s2.0-84862901893&doi=10.1111%2fj.1745-3984.2012.00166.x&partnerID=40&md5=05a1f84dc2b06eac6e98259364122e9f,"A new entry the testing lexicon is through-course summative assessment, a system consisting of components administered periodically during the academic year. As defined the Race to the Top program, these assessments are intended to yield a yearly summative score for accountability purposes. They must provide for both individual and group proficiency estimates and allow for the measurement of growth. They must accommodate students who vary their patterns of curricular exposure. Because they are meant to provide actionable information to teachers they must be instructionally sensitive, so item-operating characteristics can be expected to change relative to one another as a function of patterns of curricular exposure. This paper discusses methodology one can draw upon to tackle this ambitious collection of inferences. We consider a modeling framework that consists of an item response theory component and a population component, as the National Assessment of Educational Progress, and show how performance and growth could be expressed terms of expected performance on a market basket of tasks. We discuss conditions under which modeling simplifications might be possible and discuss studies that would be needed to fit models, estimate parameters, and evaluate data requirements. © 2012 by the National Council on Measurement in Education.",,,Article,Final,,Scopus,2-s2.0-84862901893
Mittelhaëuser M.-A.; Béguin A.A.; Sijtsma K.,"Mittelhaëuser, Marie-Anne (36093141900); Béguin, Anton A. (7003882424); Sijtsma, Klaas (7004185286)",36093141900; 7003882424; 7004185286,The Effect of Differential Motivation on IRT Linking,2015,Journal of Educational Measurement,52,3,,339,358,19,15,10.1111/jedm.12080,https://www.scopus.com/inward/record.uri?eid=2-s2.0-84940883644&doi=10.1111%2fjedm.12080&partnerID=40&md5=ffced1bb365aeb66ee154845fab6b5c6,"The purpose of this study was to investigate whether simulated differential motivation between the stakes for operational tests and anchor items produces an invalid linking result if the Rasch model is used to link the operational tests. This was done for an external anchor design and a variation of a pretest design. The study also investigated whether a constrained mixture Rasch model could identify latent classes in such a way that one latent class represented high-stakes responding while the other represented low-stakes responding. The results indicated that for an external anchor design, the Rasch linking result was only biased when the motivation level differed between the subpopulations to which the anchor items were administered. However, the mixture Rasch model did not identify the classes representing low-stakes and high-stakes responding. When a pretest design was used to link the operational tests by means of a Rasch model, the linking result was found to be biased in each condition. Bias increased as percentage of students showing low-stakes responding to the anchor items increased. The mixture Rasch model only identified the classes representing low-stakes and high-stakes responding under a limited number of conditions. © 2015 by the National Council on Measurement in Education.",,,Article,Final,,Scopus,2-s2.0-84940883644
Naumann A.; Hochweber J.; Hartig J.,"Naumann, Alexander (57057241900); Hochweber, Jan (54386865600); Hartig, Johannes (18037163300)",57057241900; 54386865600; 18037163300,Modeling Instructional Sensitivity Using a Longitudinal Multilevel Differential Item Functioning Approach,2014,Journal of Educational Measurement,51,4,,381,399,18,18,10.1111/jedm.12051,https://www.scopus.com/inward/record.uri?eid=2-s2.0-84915809460&doi=10.1111%2fjedm.12051&partnerID=40&md5=df0f92e9fbcaffaae217aa84bfd8032c,"Students' performance in assessments is commonly attributed to more or less effective teaching. This implies that students' responses are significantly affected by instruction. However, the assumption that outcome measures indeed are instructionally sensitive is scarcely investigated empirically. In the present study, we propose a longitudinal multilevel-differential item functioning (DIF) model to combine two existing yet independent approaches to evaluate items' instructional sensitivity. The model permits for a more informative judgment of instructional sensitivity, allowing the distinction of global and differential sensitivity. Exemplarily, the model is applied to two empirical data sets, with classical indices (Pretest-Posttest Difference Index and posttest multilevel-DIF) computed for comparison. Results suggest that the approach works well in the application to empirical data, and may provide important information to test developers. © 2014 by the National Council on Measurement in Education.",,,Article,Final,All Open Access; Bronze Open Access; Green Open Access,Scopus,2-s2.0-84915809460
De la Torre J.; Lee Y.-S.,"De la Torre, Jimmy (22940257400); Lee, Young-Sun (57203798701)",22940257400; 57203798701,Evaluating the wald test for item-level comparison of saturated and reduced models in cognitive diagnosis,2013,Journal of Educational Measurement,50,4,,355,373,18,64,10.1111/jedm.12022,https://www.scopus.com/inward/record.uri?eid=2-s2.0-84892888153&doi=10.1111%2fjedm.12022&partnerID=40&md5=5534bf4fa83a3c50efad6bd829c4256c,"This article used the Wald test to evaluate the item-level fit of a saturated cognitive diagnosis model (CDM) relative to the fits of the reduced models it subsumes. A simulation study was carried out to examine the Type I error and power of the Wald test in the context of the G-DINA model. Results show that when the sample size is small and a larger number of attributes are required, the Type I error rate of the Wald test for the DINA and DINO models can be higher than the nominal significance levels, while the Type I error rate of the A-CDM is closer to the nominal significance levels. However, with larger sample sizes, the Type I error rates for the three models are closer to the nominal significance levels. In addition, the Wald test has excellent statistical power to detect when the true underlying model is none of the reduced models examined even for relatively small sample sizes. The performance of the Wald test was also examined with real data. With an increasing number of CDMs from which to choose, this article provides an important contribution toward advancing the use of CDMs in practical educational settings. © 2013 by the National Council on Measurement in Education.",,,Article,Final,,Scopus,2-s2.0-84892888153
Levy R.; Xu Y.; Yel N.; Svetina D.,"Levy, Roy (18037788800); Xu, Yuning (56661424400); Yel, Nedim (56328298100); Svetina, Dubravka (36696956800)",18037788800; 56661424400; 56328298100; 36696956800,A Standardized Generalized Dimensionality Discrepancy Measure and a Standardized Model-Based Covariance for Dimensionality Assessment for Multidimensional Models,2015,Journal of Educational Measurement,52,2,,144,158,14,15,10.1111/jedm.12070,https://www.scopus.com/inward/record.uri?eid=2-s2.0-84930171786&doi=10.1111%2fjedm.12070&partnerID=40&md5=3db640e90a2a62848bc355928aa3d52e,"The standardized generalized dimensionality discrepancy measure and the standardized model-based covariance are introduced as tools to critique dimensionality assumptions in multidimensional item response models. These tools are grounded in a covariance theory perspective and associated connections between dimensionality and local independence. Relative to their precursors, they allow for dimensionality assessment in a more readily interpretable metric of correlations. A simulation study demonstrates the utility of the discrepancy measures' application at multiple levels of dimensionality analysis, and compares them to factor analytic and item response theoretic approaches. An example illustrates their use in practice. © 2015 by the National Council on Measurement in Education.",,,Article,Final,,Scopus,2-s2.0-84930171786
Keller L.A.; Hambleton R.K.,"Keller, Lisa A. (7202066268); Hambleton, Ronald K. (7006242264)",7202066268; 7006242264,The Long-Term Sustainability of IRT Scaling Methods in Mixed-Format Tests,2013,Journal of Educational Measurement,50,4,,390,407,17,7,10.1111/jedm.12025,https://www.scopus.com/inward/record.uri?eid=2-s2.0-84892854283&doi=10.1111%2fjedm.12025&partnerID=40&md5=e7a79151852dd2fcbf6a9af23ad45f45,"Due to recent research in equating methodologies indicating that some methods may be more susceptible to the accumulation of equating error over multiple administrations, the sustainability of several item response theory methods of equating over time was investigated. In particular, the paper is focused on two equating methodologies: fixed common item parameter scaling (with two variations, FCIP-1 and FCIP-2) and the Stocking and Lord characteristic curve scaling technique in the presence of nonequivalent groups. Results indicated that the improvements made to fixed common item parameter scaling in the FCIP-2 method were sustained over time. FCIP-2 and Stocking and Lord characteristic curve scaling performed similarly in many instances and produced more accurate results than FCIP-1. The relative performance of FCIP-2 and Stocking and Lord characteristic curve scaling depended on the nature of the change in the ability distribution: Stocking and Lord characteristic curve scaling captured the change in the distribution more accurately than FCIP-2 when the change was different across the ability distribution; FCIP-2 captured the changes more accurately when the change was consistent across the ability distribution. © 2013 by the National Council on Measurement in Education.",,,Article,Final,,Scopus,2-s2.0-84892854283
Dorans N.J.,"Dorans, Neil J. (6602289148)",6602289148,"On attempting to do what lord said was impossible: Commentary on van der Linden's ""Some Conceptual Issues in Observed-Score Equating""",2013,Journal of Educational Measurement,50,3,,304,314,10,5,10.1111/jedm.12017,https://www.scopus.com/inward/record.uri?eid=2-s2.0-84890868184&doi=10.1111%2fjedm.12017&partnerID=40&md5=d0a296cc16b311fd9298541939bb9f11,"van der Linden (this issue) uses words differently than Holland and Dorans. This difference in language usage is a source of some confusion in van der Linden's critique of what he calls equipercentile equating. I address these differences in language. van der Linden maintains that there are only two requirements for score equating. I maintain that the requirements he discards have practical utility and are testable. The score equity requirement proposed by Lord suggests that observed score equating was either unnecessary or impossible. Strong equity serves as the fulcrum for van der Linden's thesis. His proposed solution to the equity problem takes inequitable measures and aligns conditional error score distributions, resulting in a family of linking functions, one for each level of θ. In reality, θ is never known. Use of an anchor test as a proxy poses many practical problems, including defensibility. © 2013 by the National Council on Measurement in Education.",,,Article,Final,,Scopus,2-s2.0-84890868184
