Authors,Author full names,Author(s) ID,Title,Year,Source title,Volume,Issue,Art. No.,Page start,Page end,Page count,Cited by,DOI,Link,Abstract,Author Keywords,Index Keywords,Document Type,Publication Stage,Open Access,Source,EID
Qiao X.; Jiao H.; He Q.,"Qiao, Xin (57201984849); Jiao, Hong (55155258600); He, Qiwei (55027328300)",57201984849; 55155258600; 55027328300,"Multiple-Group Joint Modeling of Item Responses, Response Times, and Action Counts with the Conway-Maxwell-Poisson Distribution",2023,Journal of Educational Measurement,60,2,,255,281,26,3,10.1111/jedm.12349,https://www.scopus.com/inward/record.uri?eid=2-s2.0-85143308079&doi=10.1111%2fjedm.12349&partnerID=40&md5=d4f9c03cabec26c18602edef7f6ab798,"Multiple group modeling is one of the methods to address the measurement noninvariance issue. Traditional studies on multiple group modeling have mainly focused on item responses. In computer-based assessments, joint modeling of response times and action counts with item responses helps estimate the latent speed and action levels in addition to latent ability. These two new data sources can also be used to further address the measurement noninvariance issue. One challenge, however, is to correctly model action counts which can be underdispersed, overdispersed, or equidispersed in real data sets. To address this, we adopted the Conway-Maxwell-Poisson distribution that accounts for different types of dispersion in action counts and incorporated it in the multiple group joint modeling of item responses, response times, and action counts. Bayesian Markov Chain Monte Carlo method was used for model parameter estimation. To illustrate an application of the proposed model, an empirical data analysis was conducted using the Programme for International Student Assessment (PISA) 2015 collaborative problem-solving items where potential measurement noninvariance issue existed between gender groups. Results indicated that Conway-Maxwell-Poisson model yielded better model fit than alternative count data models such as negative binomial and Poisson models. In addition, response times and action counts provided further information on performance differences between groups. © 2022 by the National Council on Measurement in Education.",,,Article,Final,,Scopus,2-s2.0-85143308079
Jones P.; Tong Y.; Liu J.; Borglum J.; Primoli V.,"Jones, Paul (57679299800); Tong, Ye (9249492600); Liu, Jinghua (57680217800); Borglum, Joshua (57679909100); Primoli, Vince (58332233400)",57679299800; 9249492600; 57680217800; 57679909100; 58332233400,Score Comparability between Online Proctored and In-Person Credentialing Exams,2022,Journal of Educational Measurement,59,2,,180,207,27,6,10.1111/jedm.12320,https://www.scopus.com/inward/record.uri?eid=2-s2.0-85129863021&doi=10.1111%2fjedm.12320&partnerID=40&md5=538e63920d3ed9cf32f708b793c55b12,"This article studied two methods to detect mode effects in two credentialing exams. In Study 1, we used a “modal scale comparison approach,” where the same pool of items was calibrated separately, without transformation, within two TC cohorts (TC1 and TC2) and one OP cohort (OP1) matched on their pool-based scale score distributions. The calibrations from all three groups were used to score the TC2 cohort, designated the validation sample. The TC1 item parameters and TC1-based thetas and pass rates were more like the native TC2 values than the OP1-based values, indicating mode effects, but the score and pass/fail decision differences were small. In Study 2, we used a “cross-modal repeater approach” in which test takers who failed their first attempt in one modality took the test again in either the same or different modality. The two pairs of repeater groups (TC → TC: TC → OP, and OP → OP: OP → TC) were matched exactly on their first attempt scores. Results showed increased pass rate and greater score variability in all conditions involving OP, with mode effects noticeable in both the TC → OP condition and less-strongly in the OP → TC condition. Limitations of the study and implications for exam developers were discussed. © 2022 by the National Council on Measurement in Education.",,,Article,Final,,Scopus,2-s2.0-85129863021
Chen C.-W.; Andersson B.; Zhu J.,"Chen, Chia-Wen (55633283000); Andersson, Björn (7401941749); Zhu, Jinxin (56468215300)",55633283000; 7401941749; 56468215300,A Factor Mixture Model for Item Responses and Certainty of Response Indices to Identify Student Knowledge Profiles,2023,Journal of Educational Measurement,60,1,,28,51,23,0,10.1111/jedm.12344,https://www.scopus.com/inward/record.uri?eid=2-s2.0-85139650896&doi=10.1111%2fjedm.12344&partnerID=40&md5=a79016662eb51be8779e96301fb1f1ce,"The certainty of response index (CRI) measures respondents' confidence level when answering an item. In conjunction with the answers to the items, previous studies have used descriptive statistics and arbitrary thresholds to identify student knowledge profiles with the CRIs. Whereas this approach overlooked the measurement error of the observed item responses and indices, we address this by proposing a factor mixture model that integrates a latent class model to detect student subgroups and a measurement model to control for student ability and confidence level. Applying the model to 773 seventh graders' responses to an algebra test, where some items were related to new material that had not been taught in class, we found two subgroups: (1) students who had high confidence in answering items involving the new material; and (2) students who had low confidence in answering items involving the new material but higher general self-confidence than the first group. We regressed the posterior probability of the group membership on gender, prior achievement, and preview behavior and found preview behavior a significant factor associated with the membership. Finally, we discussed the implications of the current study for teaching practices and future research. © 2022 The Authors. Journal of Educational Measurement published by Wiley Periodicals LLC on behalf of National Council on Measurement in Education.",,,Article,Final,All Open Access; Hybrid Gold Open Access,Scopus,2-s2.0-85139650896
Becker B.; Weirich S.; Goldhammer F.; Debeer D.,"Becker, Benjamin (57219514845); Weirich, Sebastian (54790322500); Goldhammer, Frank (9274883100); Debeer, Dries (55765500900)",57219514845; 54790322500; 9274883100; 55765500900,Controlling the Speededness of Assembled Test Forms: A Generalization to the Three-Parameter Lognormal Response Time Model,2023,Journal of Educational Measurement,60,4,,551,574,23,0,10.1111/jedm.12364,https://www.scopus.com/inward/record.uri?eid=2-s2.0-85156198966&doi=10.1111%2fjedm.12364&partnerID=40&md5=d2541e2d53972aff713d84cfdf556200,"When designing or modifying a test, an important challenge is controlling its speededness. To achieve this, van der Linden (2011a, 2011b) proposed using a lognormal response time model, more specifically the two-parameter lognormal model, and automated test assembly (ATA) via mixed integer linear programming. However, this approach has a severe limitation, in that the two-parameter lognormal model lacks a slope parameter. This means that the model assumes that all items are equally speed sensitive. From a conceptual perspective, this assumption seems very restrictive. Furthermore, various other empirical studies and new data analyses performed by us show that this assumption almost never holds in practice. To overcome this shortcoming, we bring together the already frequently used three-parameter lognormal model for response times, which contains a slope parameter, and the ATA approach for controlling speededness by van der Linden. Using multiple empirically based illustrations, the proposed extension is illustrated, including complete and documented R code. Both the original van der Linden approach and our newly proposed approach are available to practitioners in the freely available R package eatATA. © 2023 The Authors. Journal of Educational Measurement published by Wiley Periodicals LLC on behalf of National Council on Measurement in Education.",,,Article,Final,All Open Access; Hybrid Gold Open Access,Scopus,2-s2.0-85156198966
DeCarlo L.T.; Zhou X.,"DeCarlo, Lawrence T. (6701664430); Zhou, Xiaoliang (57215022516)",6701664430; 57215022516,A Latent Class Signal Detection Model for Rater Scoring with Ordered Perceptual Distributions,2021,Journal of Educational Measurement,58,1,,31,53,22,1,10.1111/jedm.12265,https://www.scopus.com/inward/record.uri?eid=2-s2.0-85079718700&doi=10.1111%2fjedm.12265&partnerID=40&md5=461bbef1753ba1343e060ba1dda01d1a,"In signal detection rater models for constructed response (CR) scoring, it is assumed that raters discriminate equally well between different latent classes defined by the scoring rubric. An extended model that relaxes this assumption is introduced; the model recognizes that a rater may not discriminate equally well between some of the scoring classes. The extension recognizes a different type of rater effect and is shown to offer useful tests and diagnostic plots of the equal discrimination assumption, along with ways to assess rater accuracy and various rater effects. The approach is illustrated with an application to a large-scale language test. © 2020 by the National Council on Measurement in Education",,,Article,Final,,Scopus,2-s2.0-85079718700
Hurtz G.M.; Mucino R.,"Hurtz, Gregory M. (6602249619); Mucino, Regi (59123521100)",6602249619; 59123521100,Expanding the Lognormal Response Time Model Using Profile Similarity Metrics to Improve the Detection of Anomalous Testing Behavior,2024,Journal of Educational Measurement,,,,,,,0,10.1111/jedm.12395,https://www.scopus.com/inward/record.uri?eid=2-s2.0-85192790635&doi=10.1111%2fjedm.12395&partnerID=40&md5=d5eaaffbd7c7c9612b7980818a7b18d5,"The Lognormal Response Time (LNRT) model measures the speed of test-takers relative to the normative time demands of items on a test. The resulting speed parameters and model residuals are often analyzed for evidence of anomalous test-taking behavior associated with fast and poorly fitting response time patterns. Extending this model, we demonstrate the connection between the existing LNRT model parameters and the “level” component of profile similarity, and we define two new parameters for the LNRT model representing profile “dispersion” and “shape.” We show that while the LNRT model measures level (speed), profile dispersion and shape are conflated in model residuals, and that distinguishing them provides meaningful and useful parameters for identifying anomalous testing behavior. Results from data in a situation where many test-takers gained preknowledge of test items revealed that profile shape, not currently measured in the LNRT model, was the most sensitive response time index to the abnormal test-taking behavior patterns. Results strongly support expanding the LNRT model to measure not only each test-taker's level of speed, but also the dispersion and shape of their response time profiles. © 2024 by the National Council on Measurement in Education.",,,Article,Article in press,,Scopus,2-s2.0-85192790635
Pan Y.; Wollack J.A.,"Pan, Yiqin (57207947064); Wollack, James A. (6701334965)",57207947064; 6701334965,An Unsupervised-Learning-Based Approach to Compromised Items Detection,2021,Journal of Educational Measurement,58,3,,413,433,20,6,10.1111/jedm.12299,https://www.scopus.com/inward/record.uri?eid=2-s2.0-85113615199&doi=10.1111%2fjedm.12299&partnerID=40&md5=ad6b1b76a6b307ca63854942bf621ed2,"As technologies have been improved, item preknowledge has become a common concern in the test security area. The present study proposes an unsupervised-learning-based approach to detect compromised items. The unsupervised-learning-based compromised item detection approach contains three steps: (1) classify responses of each examinee as either normal or aberrant based on both the item response and the response time; (2) use a recursive algorithm to cluster examinees into groups based on their response similarity; (3) identify the group with strongest preknowledge signal and report questionable items as compromised. Results show that under the conditions studied, provided the amount of preknowledge is not overwhelming and aberrance effect is at least moderate, the approach controls the false-negative rate at a relatively low level and the false-positive rate at an extremely low level. © 2021 by the National Council on Measurement in Education",,,Article,Final,,Scopus,2-s2.0-85113615199
Mutak A.; Krause R.; Ulitzsch E.; Much S.; Ranger J.; Pohl S.,"Mutak, Augustin (57474384700); Krause, Robert (57213790200); Ulitzsch, Esther (57192248606); Much, Sören (57224058292); Ranger, Jochen (37049459900); Pohl, Steffi (23398048100)",57474384700; 57213790200; 57192248606; 57224058292; 37049459900; 23398048100,Modeling the Intraindividual Relation of Ability and Speed within a Test,2024,Journal of Educational Measurement,,,,,,,0,10.1111/jedm.12391,https://www.scopus.com/inward/record.uri?eid=2-s2.0-85190770841&doi=10.1111%2fjedm.12391&partnerID=40&md5=6dfc7f1de6fbfe9f8f542c7606967e7c,"Understanding the intraindividual relation between an individual's speed and ability in testing scenarios is essential to assure a fair assessment. Different approaches exist for estimating this relationship, that either rely on specific study designs or on specific assumptions. This paper aims to add to the toolbox of approaches for estimating this relationship. We propose the intraindividual speed-ability-relation (ISAR) model, which relies on nonstationarity of speed and ability over the course of the test. The ISAR model explicitly models intraindividual change in ability and speed within a test and assesses the intraindividual relation of speed and ability by evaluating the relationship of both latent change variables. Model estimation is good, when there are interindividual differences in speed and ability changes in the data. In empirical data from PISA, we found that the intraindividual relationship between speed and ability is not universally negative for all individuals and varies across different competence domains and countries. We discuss possible explanations for this relationship. © 2024 The Authors. Journal of Educational Measurement published by Wiley Periodicals LLC on behalf of National Council on Measurement in Education.",,,Article,Article in press,All Open Access; Hybrid Gold Open Access,Scopus,2-s2.0-85190770841
Gorney K.; Wollack J.A.,"Gorney, Kylie (57481973300); Wollack, James A. (6701334965)",57481973300; 6701334965,Generating Models for Item Preknowledge,2022,Journal of Educational Measurement,59,1,,22,42,20,5,10.1111/jedm.12309,https://www.scopus.com/inward/record.uri?eid=2-s2.0-85126030783&doi=10.1111%2fjedm.12309&partnerID=40&md5=eaa253e51f222269c787bf262bd351fb,"Detection methods for item preknowledge are often evaluated in simulation studies where models are used to generate the data. To ensure the reliability of such methods, it is crucial that these models are able to accurately represent situations that are encountered in practice. The purpose of this article is to provide a critical analysis of common models that have been used to simulate preknowledge. Both response accuracy (RA) and response time (RT) models are considered. The justifications and supporting evidence for each model are evaluated using three real data sets, and the impact of generating model on detection power is examined in two simulation studies. © 2022 The Authors. Journal of Educational Measurement published by Wiley Periodicals LLC on behalf of National Council on Measurement in Education.",,,Article,Final,All Open Access; Hybrid Gold Open Access,Scopus,2-s2.0-85126030783
Hassan M.U.; Miller F.,"Hassan, Mahmood Ul (57209311288); Miller, Frank (55419701000)",57209311288; 55419701000,Optimal Calibration of Items for Multidimensional Achievement Tests,2024,Journal of Educational Measurement,61,2,,274,302,28,0,10.1111/jedm.12386,https://www.scopus.com/inward/record.uri?eid=2-s2.0-85187667942&doi=10.1111%2fjedm.12386&partnerID=40&md5=b5dfc89ad3ce681f7f21ec5eb9c73679,"Multidimensional achievement tests are recently gaining more importance in educational and psychological measurements. For example, multidimensional diagnostic tests can help students to determine which particular domain of knowledge they need to improve for better performance. To estimate the characteristics of candidate items (calibration) for future multidimensional achievement tests, we use optimal design theory. We generalize a previously developed exchange algorithm for optimal design computation to the multidimensional setting. We also develop an asymptotic theorem saying which item should be calibrated by examinees with extreme abilities. For several examples, we compute the optimal design numerically with the exchange algorithm. We see clear structures in these results and explain them using the asymptotic theorem. Moreover, we investigate the performance of the optimal design in a simulation study. © 2024 The Authors. Journal of Educational Measurement published by Wiley Periodicals LLC on behalf of National Council on Measurement in Education.",,,Article,Final,,Scopus,2-s2.0-85187667942
Yavuz Temel G.,"Yavuz Temel, Güler (57613528600)",57613528600,Detecting Multidimensional DIF in Polytomous Items with IRT Methods and Estimation Approaches,2024,Journal of Educational Measurement,61,1,,69,98,29,1,10.1111/jedm.12377,https://www.scopus.com/inward/record.uri?eid=2-s2.0-85174145245&doi=10.1111%2fjedm.12377&partnerID=40&md5=1440cdeb3d5ac027849125a9a90e3eba,"The purpose of this study was to investigate multidimensional DIF with a simple and nonsimple structure in the context of multidimensional Graded Response Model (MGRM). This study examined and compared the performance of the IRT-LR and Wald test using MML-EM and MHRM estimation approaches with different test factors and test structures in simulation studies and applying real data sets. When the test structure included two dimensions, the IRT-LR (MML-EM) generally performed better than the Wald test and provided higher power rates. If the test included three dimensions, the methods provided similar performance in DIF detection. In contrast to these results, when the number of dimensions in the test was four, MML-EM estimation completely lost precision in estimating the nonuniform DIF, even with large sample sizes. The Wald with MHRM estimation approaches outperformed the Wald test (MML-EM) and IRT-LR (MML-EM). The Wald test had higher power rate and acceptable type I error rates for nonuniform DIF with the MHRM estimation approach.The small and/or unbalanced sample sizes, small DIF magnitudes, unequal ability distributions between groups, number of dimensions, estimation methods and test structure were evaluated as important test factors for detecting multidimensional DIF. © 2023 by the National Council on Measurement in Education.",,,Article,Final,All Open Access; Bronze Open Access,Scopus,2-s2.0-85174145245
Liu J.; Meng X.; Xu G.; Gao W.; Shi N.,"Liu, Jia (58607916800); Meng, Xiangbin (55932465300); Xu, Gongjun (57200611437); Gao, Wei (15848238700); Shi, Ningzhong (7004451232)",58607916800; 55932465300; 57200611437; 15848238700; 7004451232,MSAEM Estimation for Confirmatory Multidimensional Four-Parameter Normal Ogive Models,2024,Journal of Educational Measurement,61,1,,99,124,25,0,10.1111/jedm.12378,https://www.scopus.com/inward/record.uri?eid=2-s2.0-85173732880&doi=10.1111%2fjedm.12378&partnerID=40&md5=4ee17b33833cb3908282e96c2436fd7f,"In this paper, we develop a mixed stochastic approximation expectation-maximization (MSAEM) algorithm coupled with a Gibbs sampler to compute the marginalized maximum a posteriori estimate (MMAPE) of a confirmatory multidimensional four-parameter normal ogive (M4PNO) model. The proposed MSAEM algorithm not only has the computational advantages of the stochastic approximation expectation-maximization (SAEM) algorithm for multidimensional data, but it also alleviates the potential instability caused by label-switching, and then improved the estimation accuracy. Simulation studies are conducted to illustrate the good performance of the proposed MSAEM method, where MSAEM consistently performs better than SAEM and some other existing methods in multidimensional item response theory. Moreover, the proposed method is applied to a real data set from the 2018 Programme for International Student Assessment (PISA) to demonstrate the usefulness of the 4PNO model as well as MSAEM in practice. © 2023 by the National Council on Measurement in Education.",,,Article,Final,,Scopus,2-s2.0-85173732880
Dorsey D.W.; Michaels H.R.,"Dorsey, David W. (7004925510); Michaels, Hillary R. (57216874594)",7004925510; 57216874594,Validity Arguments Meet Artificial Intelligence in Innovative Educational Assessment: A Discussion and Look Forward,2022,Journal of Educational Measurement,59,3,,389,394,5,0,10.1111/jedm.12330,https://www.scopus.com/inward/record.uri?eid=2-s2.0-85131509648&doi=10.1111%2fjedm.12330&partnerID=40&md5=1bbf8faed2aca2d8810f9261e02ece36,"In this concluding article of the special issue, we provide an overall discussion and point to future emerging trends in AI that might shape our approach to validity and building validity arguments. © 2022 by the National Council on Measurement in Education.",,,Article,Final,,Scopus,2-s2.0-85131509648
Kim R.Y.; Yoo Y.J.,"Kim, Rae Yeong (57778109800); Yoo, Yun Joo (7201926465)",57778109800; 7201926465,Cognitive Diagnostic Multistage Testing by Partitioning Hierarchically Structured Attributes,2023,Journal of Educational Measurement,60,1,,126,147,21,1,10.1111/jedm.12339,https://www.scopus.com/inward/record.uri?eid=2-s2.0-85133399391&doi=10.1111%2fjedm.12339&partnerID=40&md5=d0ec190436cd3ac9384fd570bb320bfc,"In cognitive diagnostic models (CDMs), a set of fine-grained attributes is required to characterize complex problem solving and provide detailed diagnostic information about an examinee. However, it is challenging to ensure reliable estimation and control computational complexity when The test aims to identify the examinee's attribute profile in a large-scale map of attributes. To address this problem, this study proposes a cognitive diagnostic multistage testing by partitioning hierarchically structured attributes (CD-MST-PH) as a multistage testing for CDM. In CD-MST-PH, multiple testlets can be constructed based on separate attribute groups before testing occurs, which retains the advantages of multistage testing over fully adaptive testing or the on-the-fly approach. Moreover, testlets are offered sequentially and adaptively, thus improving test accuracy and efficiency. An item information measure is proposed to compute the discrimination power of an item for each attribute, and a module assembly method is presented to construct modules anchored at each separate attribute group. Several module selection indices for CD-MST-PH are also proposed by modifying the item selection indices used in cognitive diagnostic computerized adaptive testing. The results of simulation study show that CD-MST-PH can improve test accuracy and efficiency relative to the conventional test without adaptive stages. © 2022 by the National Council on Measurement in Education.",,,Article,Final,,Scopus,2-s2.0-85133399391
Bengs D.; Kroehne U.; Brefeld U.,"Bengs, Daniel (56556818200); Kroehne, Ulf (55849736300); Brefeld, Ulf (8279934000)",56556818200; 55849736300; 8279934000,Simultaneous Constrained Adaptive Item Selection for Group-Based Testing,2021,Journal of Educational Measurement,58,2,,236,261,25,1,10.1111/jedm.12285,https://www.scopus.com/inward/record.uri?eid=2-s2.0-85092653620&doi=10.1111%2fjedm.12285&partnerID=40&md5=993b912e0ab26e0f00038e7f9efa0b7d,"By tailoring test forms to the test-taker's proficiency, Computerized Adaptive Testing (CAT) enables substantial increases in testing efficiency over fixed forms testing. When used for formative assessment, the alignment of task difficulty with proficiency increases the chance that teachers can derive useful feedback from assessment data. The application of CAT to formative assessment in the classroom, however, is hindered by the large number of different items used for the whole class; the required familiarization with a large number of test items puts a significant burden on teachers. An improved CAT procedure for group-based testing is presented, which uses simultaneous automated test assembly to impose a limit on the number of items used per group. The proposed linear model for simultaneous adaptive item selection allows for full adaptivity and the accommodation of constraints on test content. The effectiveness of the group-based CAT is demonstrated with real-world items in a simulated adaptive test of 3,000 groups of test-takers, under different assumptions on group composition. Results show that the group-based CAT maintained the efficiency of CAT, while a reduction in the number of used items by one half to two-thirds was achieved, depending on the within-group variance of proficiencies. © 2020 by the National Council on Measurement in Education",,,Article,Final,All Open Access; Hybrid Gold Open Access,Scopus,2-s2.0-85092653620
