Authors,Author full names,Author(s) ID,Title,Year,Source title,Volume,Issue,Art. No.,Page start,Page end,Page count,Cited by,DOI,Link,Abstract,Author Keywords,Index Keywords,Document Type,Publication Stage,Open Access,Source,EID
DeCarlo L.T.,"DeCarlo, Lawrence T. (6701664430)",6701664430,On Joining a Signal Detection Choice Model with Response Time Models,2021,Journal of Educational Measurement,58,4,,438,464,26,4,10.1111/jedm.12300,https://www.scopus.com/inward/record.uri?eid=2-s2.0-85114365768&doi=10.1111%2fjedm.12300&partnerID=40&md5=22167d5b86cc48650d9fbbc217a4d629,"In a signal detection theory (SDT) approach to multiple choice exams, examinees are viewed as choosing, for each item, the alternative that is perceived as being the most plausible, with perceived plausibility depending in part on whether or not an item is known. The SDT model is a process model and provides measures of item difficulty, item discrimination, and the relative plausibility of each alternative. It is shown how to incorporate information from response times into the model, which has potential benefits for estimation and also offers a way to study underlying processes. The SDT model is joined with a lognormal response time (RT) model in a manner similar to that used in hierarchical models. In addition, a mixture extension of the RT model is joined in a novel way with the SDT choice model, using the idea that the probability of “knowing” in the SDT model might be related to the probability of working in one of two speed states in the mixture RT model. A semiparametric version of the mixture RT model is also used to assess robustness. The fused SDT/RT models are examined with science items from the 2015 Program for International Student Assessment. © 2021 by the National Council on Measurement in Education",,,Article,Final,,Scopus,2-s2.0-85114365768
van der Linden W.J.; Belov D.I.,"van der Linden, Wim J. (55409657500); Belov, Dmitry I. (8355735900)",55409657500; 8355735900,A Statistical Test for the Detection of Item Compromise Combining Responses and Response Times,2023,Journal of Educational Measurement,60,2,,235,254,19,3,10.1111/jedm.12346,https://www.scopus.com/inward/record.uri?eid=2-s2.0-85141410324&doi=10.1111%2fjedm.12346&partnerID=40&md5=888c48cb2534f5dae38a34f4df7591ab,"A test of item compromise is presented which combines the test takers' responses and response times (RTs) into a statistic defined as the number of correct responses on the item for test takers with RTs flagged as suspicious. The test has null and alternative distributions belonging to the well-known family of compound binomial distributions, is simple to calculate, and has results that are easy to interpret. It also demonstrated nearly perfect power for the detection of compromise with no more than 10 test takers with preknowledge of the more difficult and discriminating items in a set of empirical examples. For the easier and less discriminating items, the presence of some 20 test takers with preknowledge still sufficed. A test based on the reverse statistic of the total time by test takers with responses flagged as suspicious may seem a natural alternative but misses the property of a monotone likelihood ratio necessary to decide between a test that should be left or right sided. © 2022 The Authors. Journal of Educational Measurement published by Wiley Periodicals LLC on behalf of National Council on Measurement in Education.",,,Article,Final,All Open Access; Green Open Access; Hybrid Gold Open Access,Scopus,2-s2.0-85141410324
Kwon T.Y.; Huggins-Manley A.C.; Templin J.; Zheng M.,"Kwon, Tae Yeon (58960789000); Huggins-Manley, A. Corinne (56479235800); Templin, Jonathan (23010693000); Zheng, Mingying (58150400700)",58960789000; 56479235800; 23010693000; 58150400700,Modeling Hierarchical Attribute Structures in Diagnostic Classification Models with Multiple Attempts,2024,Journal of Educational Measurement,61,2,,198,218,20,0,10.1111/jedm.12387,https://www.scopus.com/inward/record.uri?eid=2-s2.0-85188968888&doi=10.1111%2fjedm.12387&partnerID=40&md5=36e22c98c7dff2c9ecb5e6050bb56a3c,"In classroom assessments, examinees can often answer test items multiple times, resulting in sequential multiple-attempt data. Sequential diagnostic classification models (DCMs) have been developed for such data. As student learning processes may be aligned with a hierarchy of measured traits, this study aimed to develop a sequential hierarchical DCM (sequential HDCM), which combines a sequential DCM with the HDCM, and investigate classification accuracy of the model in the presence of hierarchies when multiple attempts are allowed in dynamic assessment. We investigated the model's impact on classification accuracy when hierarchical structures are correctly specified, misspecified, or overspecified. The results indicate that (1) a sequential HDCM accurately classified students as masters and nonmasters when the data had a hierarchical structure; (2) a sequential HDCM produced similar or slightly higher classification accuracy than nonhierarchical sequential LCDM when the data had hierarchical structures; and (3) the misspecification of the hierarchical structure of the data resulted in lower classification accuracy when the misspecified model had fewer attribute profiles than the true model. We discuss limitations and make recommendations on using the proposed model in practice. This study provides practitioners with information about the possibilities for psychometric modeling of dynamic classroom assessment data. © 2024 by the National Council on Measurement in Education.",,,Article,Final,,Scopus,2-s2.0-85188968888
Grochowalski J.H.; Hendrickson A.,"Grochowalski, Joseph H. (57022208700); Hendrickson, Amy (7006207129)",57022208700; 7006207129,Detecting Group Collaboration Using Multiple Correspondence Analysis,2023,Journal of Educational Measurement,60,3,,402,427,25,0,10.1111/jedm.12363,https://www.scopus.com/inward/record.uri?eid=2-s2.0-85150653919&doi=10.1111%2fjedm.12363&partnerID=40&md5=08fa042910b8bea23aaeaa2bac4749d6,"Test takers wishing to gain an unfair advantage often share answers with other test takers, either sharing all answers (a full key) or some (a partial key). Detecting key sharing during a tight testing window requires an efficient, easily interpretable, and rich form of analysis that is descriptive and inferential. We introduce a detection method based on multiple correspondence analysis (MCA) that identifies test takers with unusual response similarities. The method simultaneously detects multiple shared keys (partial or full), plots results, and is computationally efficient as it requires only matrix operations. We describe the method, evaluate its detection accuracy under various simulation conditions, and demonstrate the procedure on a real data set with known test-taking misbehavior. The simulation results showed that the MCA method had reasonably high power under realistic conditions and maintained the nominal false-positive level, except when the group size was very large or partial shared keys had more than 50% of the items. The real data analysis illustrated visual detection procedures and inference about the item responses possibly shared in the key, which was likely shared among 91 test takers, many of whom were confirmed by nonstatistical investigation to have engaged in test-taking misconduct. © 2023 by the National Council on Measurement in Education.",,,Article,Final,,Scopus,2-s2.0-85150653919
Ferrara S.; Qunbar S.,"Ferrara, Steve (35333949500); Qunbar, Saed (57732370800)",35333949500; 57732370800,Validity Arguments for AI-Based Automated Scores: Essay Scoring as an Illustration,2022,Journal of Educational Measurement,59,3,,288,313,25,11,10.1111/jedm.12333,https://www.scopus.com/inward/record.uri?eid=2-s2.0-85131509749&doi=10.1111%2fjedm.12333&partnerID=40&md5=bf6e30fe83e3dbcf14a1888069eaeeb5,"In this article, we argue that automated scoring engines should be transparent and construct relevant—that is, as much as is currently feasible. Many current automated scoring engines cannot achieve high degrees of scoring accuracy without allowing in some features that may not be easily explained and understood and may not be obviously and directly relevant to the target assessment construct. We address the current limitations on evidence and validity arguments for scores from automated scoring engines from the points of view of the Standards for Educational and Psychological Testing (i.e., construct relevance, construct representation, and fairness) and emerging principles in Artificial Intelligence (e.g., explainable AI, an examinee's right to explanations, and principled AI). We illustrate these concepts and arguments for automated essay scores. © 2022 by the National Council on Measurement in Education.",,,Article,Final,,Scopus,2-s2.0-85131509749
Sinharay S.; Johnson M.S.,"Sinharay, Sandip (6602980064); Johnson, Matthew S. (55723899700)",6602980064; 55723899700,Computation and Accuracy Evaluation of Comparable Scores on Culturally Responsive Assessments,2024,Journal of Educational Measurement,61,1,,5,46,41,0,10.1111/jedm.12381,https://www.scopus.com/inward/record.uri?eid=2-s2.0-85176914720&doi=10.1111%2fjedm.12381&partnerID=40&md5=84f3381ad993d41dbb323379b7b842ae,"Culturally responsive assessments have been proposed as potential tools to ensure equity and fairness for examinees from all backgrounds including those from traditionally underserved or minoritized groups. However, these assessments are relatively new and, with few exceptions, are yet to be implemented in large scale. Consequently, there is a lack of guidance on how one can compute comparable scores on various versions of these assessments. In this paper, the multigroup multidimensional Rasch model is repurposed for modeling data originating from various versions of a culturally responsive assessment and for analyzing such data to compute comparable scores. Two simulation studies are performed to evaluate the performance of the model for data simulated from hypothetical culturally responsive assessments and to find the conditions under which the computed scores are accurate. Recommendations are made for measurement practitioners interested in culturally responsive assessments. © 2023 by the National Council on Measurement in Education.",,,Article,Final,,Scopus,2-s2.0-85176914720
Guo J.; Xu X.; Xin T.,"Guo, Jinxin (57212453708); Xu, Xin (57221066152); Xin, Tao (7003499953)",57212453708; 57221066152; 7003499953,A Note on Latent Traits Estimates under IRT Models with Missingness,2023,Journal of Educational Measurement,60,4,,575,625,50,1,10.1111/jedm.12365,https://www.scopus.com/inward/record.uri?eid=2-s2.0-85153360564&doi=10.1111%2fjedm.12365&partnerID=40&md5=b349a2e0804bdc51e76b2b4e6583f49e,"Missingness due to not-reached items and omitted items has received much attention in the recent psychometric literature. Such missingness, if not handled properly, would lead to biased parameter estimation, as well as inaccurate inference of examinees, and further erode the validity of the test. This paper reviews some commonly used IRT based models allowing missingness, followed by three popular examinee scoring methods, including maximum likelihood estimation, maximum a posteriori, and expected a posteriori. Simulation studies were conducted to compare these examinee scoring methods across these commonly used models in the presence of missingness. Results showed that all the methods could infer examinees' ability accurately when the missingness is ignorable. If the missingness is nonignorable, incorporating those missing responses would improve the precision in estimating abilities for examinees with missingness, especially when the test length is short. In terms of examinee scoring methods, expected a posteriori method performed better for evaluating latent traits under models allowing missingness. An empirical study based on the PISA 2015 Science Test was further performed. © 2023 by the National Council on Measurement in Education.",,,Article,Final,,Scopus,2-s2.0-85153360564
Johnson M.S.; Liu X.; McCaffrey D.F.,"Johnson, Matthew S. (55723899700); Liu, Xiang (57191903375); McCaffrey, Daniel F. (7005049755)",55723899700; 57191903375; 7005049755,Psychometric Methods to Evaluate Measurement and Algorithmic Bias in Automated Scoring,2022,Journal of Educational Measurement,59,3,,338,361,23,9,10.1111/jedm.12335,https://www.scopus.com/inward/record.uri?eid=2-s2.0-85131007650&doi=10.1111%2fjedm.12335&partnerID=40&md5=4916295855ef63cc1b6cd4fdd101457b,"With the increasing use of automated scores in operational testing settings comes the need to understand the ways in which they can yield biased and unfair results. In this paper, we provide a brief survey of some of the ways in which the predictive methods used in automated scoring can lead to biased, and thus unfair automated scores. After providing definitions of fairness from machine learning and a psychometric framework to study them, we demonstrate how modeling decisions, like omitting variables, using proxy measures or confounded variables, and even the optimization criterion in estimation can lead to biased and unfair automated scores. We then introduce two simple methods for evaluating bias, evaluate their statistical properties through simulation, and apply to an item from a large-scale reading assessment. © 2022 by the National Council on Measurement in Education.",,,Article,Final,,Scopus,2-s2.0-85131007650
Qiao X.; Jiao H.,"Qiao, Xin (57201984849); Jiao, Hong (55155258600)",57201984849; 55155258600,Explanatory Cognitive Diagnostic Modeling Incorporating Response Times,2021,Journal of Educational Measurement,58,4,,564,585,21,1,10.1111/jedm.12306,https://www.scopus.com/inward/record.uri?eid=2-s2.0-85125066020&doi=10.1111%2fjedm.12306&partnerID=40&md5=c4070896679f2baab0e540967b2509b2,"This study proposes explanatory cognitive diagnostic model (CDM) jointly incorporating responses and response times (RTs) with the inclusion of item covariates related to both item responses and RTs. The joint modeling of item responses and RTs intends to provide more information for cognitive diagnosis while item covariates can be used to predict item parameters when item calibration is not feasible in diagnostic assessments or item parameter estimation errors could be too large due to small sample sizes for calibration. In addition, the inclusion of the item covariates allows the evaluation of cognitive theories underlying the test design in item development. Model parameter estimation is explored using the Bayesian Markov chain Monte Carlo (MCMC) method. A Monte Carlo simulation study is conducted to examine the parameter recovery of the proposed model under different simulated conditions in comparison to alternative competing models. Further, the application of the proposed model is illustrated using the Programme for International Student Assessment (PISA) 2012 problem-solving items modeling both item response and RT data. The study results indicate that model parameters can be well recovered using the MCMC algorithm and the explanatory CDM jointly incorporating item responses and RTs with item covariates holds promising applications in digital-based diagnostic assessments. © 2022 by the National Council on Measurement in Education",,,Article,Final,All Open Access; Green Open Access,Scopus,2-s2.0-85125066020
Lim H.; Davey T.; Wells C.S.,"Lim, Hwanggyu (57216896756); Davey, Tim (36785089100); Wells, Craig S. (24167495500)",57216896756; 36785089100; 24167495500,A Recursion-Based Analytical Approach to Evaluate the Performance of MST,2021,Journal of Educational Measurement,58,2,,154,178,24,3,10.1111/jedm.12276,https://www.scopus.com/inward/record.uri?eid=2-s2.0-85087157451&doi=10.1111%2fjedm.12276&partnerID=40&md5=0e018c461cdf09bc5a8b882bcae48e66,"This study proposed a recursion-based analytical approach to assess measurement precision of ability estimation and classification accuracy in multistage adaptive tests (MSTs). A simulation study was conducted to compare the proposed recursion-based analytical method with an analytical method proposed by Park, Kim, Chung, and Dodd and with the more commonly used Monte Carlo (MC) simulation approaches. The results from the simulation study indicate that the recursion-based analytical method produced more stable measurement properties in MST than the MC-based simulation method. It also produced more credible measurement performance than the analytical approach of Park, Kim, Chung, and Dodd. We expect that the recursion-based analytical method would be especially efficient in instances when multiple MST designs need to be compared to determine which one has better measurement performance. © 2020 by the National Council on Measurement in Education",,,Article,Final,,Scopus,2-s2.0-85087157451
Gorney K.; Wollack J.A.,"Gorney, Kylie (57481973300); Wollack, James A. (6701334965)",57481973300; 6701334965,Using Item Scores and Distractors in Person-Fit Assessment,2023,Journal of Educational Measurement,60,1,,3,27,24,6,10.1111/jedm.12345,https://www.scopus.com/inward/record.uri?eid=2-s2.0-85138189880&doi=10.1111%2fjedm.12345&partnerID=40&md5=9f40e68bf445a1e1eb8618caa3790301,"In order to detect a wide range of aberrant behaviors, it can be useful to incorporate information beyond the dichotomous item scores. In this paper, we extend the (Formula presented.) and (Formula presented.) person-fit statistics so that unusual behavior in item scores and unusual behavior in item distractors can be used as indicators of aberrance. Through detailed simulations, we show that the new statistics are more powerful than existing statistics in detecting several types of aberrant behavior, and that they are able to control the Type I error rate in instances where the model does not exactly fit the data. A real data example is also provided to demonstrate the utility of the new statistics in an operational setting. © 2022 The Authors. Journal of Educational Measurement published by Wiley Periodicals LLC on behalf of National Council on Measurement in Education.",,,Article,Final,All Open Access; Hybrid Gold Open Access,Scopus,2-s2.0-85138189880
Yamaguchi K.; Zhang J.,"Yamaguchi, Kazuhiro (57200510912); Zhang, Jihong (57219453191)",57200510912; 57219453191,Fully Gibbs Sampling Algorithms for Bayesian Variable Selection in Latent Regression Models,2023,Journal of Educational Measurement,60,2,,202,234,32,0,10.1111/jedm.12348,https://www.scopus.com/inward/record.uri?eid=2-s2.0-85140398095&doi=10.1111%2fjedm.12348&partnerID=40&md5=33a291c79b914a3a8cbf06f9d15c3ddb,"This study proposed Gibbs sampling algorithms for variable selection in a latent regression model under a unidimensional two-parameter logistic item response theory model. Three types of shrinkage priors were employed to obtain shrinkage estimates: double-exponential (i.e., Laplace), horseshoe, and horseshoe+ priors. These shrinkage priors were compared to a uniform prior case in both simulation and real data analysis. The simulation study revealed that two types of horseshoe priors had a smaller root mean square errors and shorter 95% credible interval lengths than double-exponential or uniform priors. In addition, the horseshoe+ prior was slightly more stable than the horseshoe prior. The real data example successfully proved the utility of horseshoe and horseshoe+ priors in selecting effective predictive covariates for math achievement. © 2022 by the National Council on Measurement in Education.",,,Article,Final,All Open Access; Green Open Access,Scopus,2-s2.0-85140398095
Tang X.; Zheng Y.; Wu T.; Hau K.-T.; Chang H.-H.,"Tang, Xiuxiu (57988841000); Zheng, Yi (55713171300); Wu, Tong (59164864300); Hau, Kit-Tai (7006812724); Chang, Hua-Hua (7407524642)",57988841000; 55713171300; 59164864300; 7006812724; 7407524642,Utilizing Response Time for Item Selection in On-the-Fly Multistage Adaptive Testing for PISA Assessment,2024,Journal of Educational Measurement,,,,,,,0,10.1111/jedm.12403,https://www.scopus.com/inward/record.uri?eid=2-s2.0-85195480974&doi=10.1111%2fjedm.12403&partnerID=40&md5=bcf73aa67ff5ca42b0cc5e8b84bd3617,"Multistage adaptive testing (MST) has been recently adopted for international large-scale assessments such as Programme for International Student Assessment (PISA). MST offers improved measurement efficiency over traditional nonadaptive tests and improved practical convenience over single-item-adaptive computerized adaptive testing (CAT). As a third alternative adaptive test design to MST and CAT, Zheng and Chang proposed the “on-the-fly multistage adaptive testing” (OMST), which combines the benefits of MST and CAT and offsets their limitations. In this study, we adopted the OMST design while also incorporating response time (RT) in item selection. Via simulations emulating the PISA 2018 reading test, including using the real item attributes and replicating PISA 2018 reading test's MST design, we compared the performance of our OMST designs against the simulated MST design in (1) measurement accuracy of test takers’ ability, (2) test time efficiency and consistency, and (3) expected gains in precision by design. We also investigated the performance of OMST in item bank usage and constraints management. Results show great potential for the proposed RT-incorporated OMST designs to be used for PISA and potentially other international large-scale assessments. © 2024 by the National Council on Measurement in Education.",,,Article,Article in press,,Scopus,2-s2.0-85195480974
Feng T.; Cai L.,"Feng, Tianying (57211690478); Cai, Li (59155077000)",57211690478; 59155077000,Sensemaking of Process Data from Evaluation Studies of Educational Games: An Application of Cross-Classified Item Response Theory Modeling,2024,Journal of Educational Measurement,,,,,,,0,10.1111/jedm.12396,https://www.scopus.com/inward/record.uri?eid=2-s2.0-85195029738&doi=10.1111%2fjedm.12396&partnerID=40&md5=5a46f940496c031c64c3ecb45061d65f,"Process information collected from educational games can illuminate how students approach interactive tasks, complementing assessment outcomes routinely examined in evaluation studies. However, the two sources of information are historically analyzed and interpreted separately, and diagnostic process information is often underused. To tackle these issues, we present a new application of cross-classified item response theory modeling, using indicators of knowledge misconceptions and item-level assessment data collected from a multisite game-based randomized controlled trial. This application addresses (a) the joint modeling of students' pretest and posttest item responses and game-based processes described by indicators of misconceptions; (b) integration of gameplay information when gauging the intervention effect of an educational game; (c) relationships among game-based misconception, pretest initial status, and pre-to-post change; and (d) nesting of students within schools, a common aspect in multisite research. We also demonstrate how to structure the data and set up the model to enable our proposed application, and how our application compares to three other approaches to analyzing gameplay and assessment data. Lastly, we note the implications for future evaluation studies and for using analytic results to inform learning and instruction. © 2024 The Authors. Journal of Educational Measurement published by Wiley Periodicals LLC on behalf of National Council on Measurement in Education.",,,Article,Article in press,All Open Access; Hybrid Gold Open Access,Scopus,2-s2.0-85195029738
Xu L.; Wang S.; Cai Y.; Tu D.,"Xu, Lingling (57220777583); Wang, Shiyu (55940206100); Cai, Yan (57196027339); Tu, Dongbo (57196026901)",57220777583; 55940206100; 57196027339; 57196026901,The Automated Test Assembly and Routing Rule for Multistage Adaptive Testing with Multidimensional Item Response Theory,2021,Journal of Educational Measurement,58,4,,538,563,25,2,10.1111/jedm.12305,https://www.scopus.com/inward/record.uri?eid=2-s2.0-85123506143&doi=10.1111%2fjedm.12305&partnerID=40&md5=fc7e94e54d03e0b5d69fe01220e71f04,"Designing a multidimensional adaptive test (M-MST) based on a multidimensional item response theory (MIRT) model is critical to make full use of the advantages of both MST and MIRT in implementing multidimensional assessments. This study proposed two types of automated test assembly (ATA) algorithms and one set of routing rules that can facilitate the development of an M-MST. Different M-MST designs were developed based on the proposed ATA algorithms and routing rules and were evaluated through two sets of simulation studies. Study 1 used simulated item banks and considered a variety of testing factors, and results from which can inform us the theoretical performance of the proposed M-MST designs. Study 2 was designed based on a real multidimensional assessment. In addition, a MCAT was simulated as a baseline design to demonstrate the advantage of the proposed M-MST design in each study. Our simulation results indicate that the proposed ATA algorithms and routing rule can generate M-MSTs with a good-quality control and the same or even better ability estimation results than the MCAT given the same condition. This demonstrates the advantage of using M-MST for multidimensional assessment especially for the one that needs to satisfy many nonstatistical constraints. © 2022 by the National Council on Measurement in Education",,,Article,Final,,Scopus,2-s2.0-85123506143
